SHPNSHANM,SERIESNM
あいうえお館,ウルトラかいじゅう絵本
あいうえお館,ウルトラマン
あかね書房,おばけのポーちゃん
あかね書房,いぬうえくんとくまざわくん
あかね書房,日本の神話
あかね書房,プカプカチョコレー島
あかね書房,あかね・新えほんシリーズ
あかね書房,おばけトリックアート
あかね書房,日本の昔話えほん
あかね書房,ＳＤＧｓノンフィクション　食品ロス
あかね書房,ことばとえ
あかね書房,おばけのはなし
あかね書房,伝記を読もう
あかね書房,山田県立山田小学校
あかね書房,ジオジオ
あかね書房,あかね新・えほんシリーズ
あかね書房,ぞくぞく村
あかね書房,日本むかしばなし
あかね書房,乗り物ひみつルポ
あかね書房,すきっぷぶっくす　2
あかね書房,ごみについて調べよう
あかね書房,願いがかなうめちゃハピ
あかね書房,３分間サバイバル
あかね書房,トリックアートアドベンチャー
あかね書房,あかね新えほんシリーズ
あかね書房,わかったさんとおかしをつくろう！
あかね書房,えほん、よんで！
あかね書房,あかね創作えほん
あかね書房,かえるえんみどりぐみ
あかね書房,こまったさん
あかね書房,かばくん・くらしのえほん
あかね書房,七不思議神社
あかね書房,けんちゃんとあそぼう
あかね書房,緑川聖司の七不思議神社
あかね書房,たまごのほん
あかね書房,くまたくんのえほん
あかね書房,わかったさんのおかしシリーズ
あかね書房,ナツカのおばけ事件簿
あかね書房,ゆうたくんちのいばりいぬ
あかね書房,ふしぎパティシエールみるか
あかね書房,スプラッシュ・ストーリーズ
あかね書房,ふしぎ町のふしぎレストラン
あかね書房,めくるしかけえほん
あかね書房,あしたのための本
あかね書房,ぴょこたんのあたまのたいそう
あかね書房,からだのえほん
あかね書房,あじわう絵本
あかね書房,ゆびにんぎょうえほん
あかね書房,あかねせかいの本
あかね書房,くりのきえんのおともだち
あすなろ書房,日本語を味わう名詩入門
あすなろ書房,黒い兄弟
あすなろ書房,シートンどうぶつ記
あすなろ書房,赤ちゃんのための絵本
あすなろ書房,チュウチュウ通り
あすなろ書房,中学生までに読んでおきたい哲学
あすなろ書房,小学生までに読んでおきたい文学
あすなろ書房,日本昔ばなし絵本
あすなろ書房,アラン・グレのＡＢＣえほん
あすなろ書房,ちょっと昔の子どもたちのくらし
あすなろ書房,妖怪コンビニ
あすなろ書房,からだのひみつ、げんきのしくみ！
あすなろ書房,うさぴょんのせいかつ絵本
あすなろ書房,中学生までに読んでおきたい日本文学
あすなろ書房,輪切り図鑑クロスセクション
いかだ社,Ｋｉｄｓ工作ＢＯＯＫ
いのちのことば社,〈ペーパーバック版〉たいせつなきみブッククラブ
かんき出版,大学入学共通テスト
くもん出版,くもんの小学ドリル
くもん出版,はじめてであうえほんシリーズ
くもん出版,くもんのスーパードリル
くもん出版,高校入試対策総復習
くもん出版,子どもとよむ日本の昔ばなし
くもん出版,Ｋｏｔｅｎ　Ｃｏｍｉｃｓ
くもん出版,くもんこれからの学び
くもん出版,見て　聞いて　まねして　楽しむ　歌舞伎絵本
くもん出版,活用型問題できたえる
くもん出版,くもんのまんがおもしろ大事典
くもん出版,くもんのかんがえるワーク
くもん出版,シールたっぷりレッスン
くもん出版,おしゃべりペンでおけいこ！
くもん出版,ゆびであそぶえほん
くもん出版,知ってびっくり！歯のひみつがわかる絵本
くもん出版,スーパーステップ
くもん出版,おはなし・くろくま
くもん出版,えんぴつがいらないどこでもレッスン！
くもん出版,おやこでいっしょに
くもん出版,くもんのＳＴＥＭナビ　サイエンス
くもん出版,いっきに極める小学英語
くもん出版,中学基礎がため１００％
くもん出版,くもんの高校入試英語完全攻略トレーニング
くもん出版,くもんの総復習ドリルシリーズ
くもん出版,くもんの夏休みドリルシリーズ
くもん出版,くもん幼児ドリル
くもん出版,あかちゃんごきげん
くもん出版,赤ちゃんとあそぶカード
くもん出版,くもんのにがてたいじドリル
くもん出版,ロジカル国語
くもん出版,教科書にでてくる古典
くもん出版,子どもとたのしむはじめてのえいごえほん
くもん出版,ひかりではっけん
くもん出版,えほんとあそぼう
くもん出版,くもんの完成チェックテスト
くもん出版,もっとぐんぐん復習ドリル
くもん出版,総復習ドリルシリーズ
くもん出版,１１歳のバースデー
くもん出版,わくわくくろくま
くもん出版,高校入試得点直結トレーニング
くもん出版,ファーストステップ
くもん出版,くろくまくんの　かたりかけえほん
くもん出版,くもんの写真図鑑カード
くもん出版,くもんの生活図鑑カード
くもん出版,えほんとあそぼ
くもん出版,はじめてであうえほん
くもん出版,２時間でニャンとかできる中学歴史
くもん出版,くもんの高校入試スタートドリル
くもん出版,くもんの自然図鑑カード
くもん出版,シンキングスキル
くもん出版,おはなしくろくま
くもん出版,くろくまくんのことばえほん
くもん出版,集中学習ドリル
くもん出版,ひらめく！シリーズ
くもん出版,これでだいじょうぶ！
くもん出版,くもんジュニアサイエンス
くもん出版,算数の壁をすらすら攻略
くもん出版,入学準備
くもん出版,くもんの高校入試対策
くもん出版,パズルではじめるかん字
くもん出版,幼稚園にはいったら
くもん出版,いっきに極める
くもん出版,くもんの高校入試完全攻略トレーニング
くもん出版,博士シリーズ
こぐま会出版部,こぐま教育新書
こぐま社,こぐまのどんどんぶんこ
こぐま社,絵巻えほん
こぐま社,わらべうたえほん
こぐま社,馬場のぼるの絵本
こぐま社,こぐまちゃん
こぐま社,ぶうとぴょんのえほん
こぐま社,１１ぴきのねこ
こぐま社,三浦太郎の絵本
すばる舎,どうぶつ絵本
すばる舎,めくって楽しい穴あき絵本
すばる舎,ブラウンストーンいちぞくのぼうけん
たちばな出版,ディズニー
たちばな出版,ディズニー・おはなしぬりえ
たちばな出版,戸渡阿見絵本シリーズ
たちばな出版,ディズニー_ぬりえ
のら書店,どうぶつ絵本
のら書店,むかしばなし
のら書店,グリムのむかしばなし
ひかりのくに,フェーマスしんぶん
ひかりのくに,０・１・２歳の　ゆびさし　しゃしん　ずかん
ひかりのくに,０・１・２さいのずかん
ひかりのくに,ひかりのくに傑作絵本集
ひかりのくに,１０ぴきのおばけ
ひかりのくに,辞書びきえほん
ひかりのくに,あかちゃんあそぼ
ひかりのくに,たっぷりしゃしんずかん
ひかりのくに,おやさい生活えほん
ひかりのくに,ゆっくとすっくＢａｂｙ
ひかりのくに,はたらくくるま
ひかりのくに,一年生のおはなし
ひかりのくに,あかちゃんとよむえほん
ひかりのくに,ゆっくとすっくの絵本
ひかりのくに,えさがしえほん
ひかりのくに,じゅうにしのはなし
ひかりのくに,右脳＋左脳レベルアップドリル
ひかりのくに,くすのきだんち
ひかりのくに,くすのきだんちシリーズ
ひかりのくに,ルンバさんと１０５つごちゃん
ひかりのくに,３さいからののりものずかん
ひかりのくに,あたらしい創作絵本大賞セレクション
ひかりのくに,３さいからのあそべるずかん
ひかりのくに,どうぶつ絵本
ひかりのくに,ことばどんどん
ひかりのくに,わくわくユーモアえほん
ひかりのくに,わくわく♪ユーモアえほん
ひさかたチャイルド,のりものしかけ絵本シリーズ
ひさかたチャイルド,０歳・１歳・２歳児の絵本
ひさかたチャイルド,おべんとうバス
ひさかたチャイルド,おおきなかがく
ひさかたチャイルド,はたらくくるま
ひさかたチャイルド,はじめてめいさく
ひさかたチャイルド,スキンシップ絵本
ひさかたチャイルド,ポップアップ絵本
ひさかたチャイルド,パノラマえほん
ひさかたチャイルド,ぽかぽかおふろシリーズ
ひさかたチャイルド,ひさかたメルヘン
ひさかたチャイルド,あかちゃんのための絵本
ひさかたチャイルド,しぜんにタッチ！
ひさかたチャイルド,わらべうたえほん
ひさかたチャイルド,あてっこしかけえほん
ひさかたチャイルド,ぽかぽかおふろ
ひさかたチャイルド,絵本で知ろう！ＳＤＧｓ
ひつじ書房,みる・よむ・きく南の島ことば絵本　多良間島
ぺりかん社,なるにはＢＯＯＫＳ
ほぼ日刊イトイ新聞,ほぼにちの絵本
ほぼ日刊イトイ新聞,ほぼ日ブックス
ほるぷ出版,パタパタえほん
ほるぷ出版,はじめてのこよみえほん
ほるぷ出版,めくって たのしい しかけえほん
ほるぷ出版,いま・生きる・ちからシリーズ
ほるぷ出版,ほるぷ動物園えほん
ほるぷ出版,あなあき〇せいかつえほん
ほるぷ出版,めくってたのしいしかけえほん
ほるぷ出版,マークで学ぶＳＤＧｓ
ほるぷ出版,新紙幣ウラオモテ
ほるぷ出版,からだをうごかすえほん
ほるぷ出版,あんしんゲット！の絵本
ほるぷ出版,＜新版＞サトクリフ・コレクション
ほるぷ出版,十年屋＜児童版＞
ほるぷ出版,おいしい行事のえほん
ほるぷ出版,はじめてのいきもの
ほるぷ出版,はじめての行事えほん
ほるぷ出版,のりものはてなえほん
ほるぷ出版,あかちゃんがよろこぶしかけえほん
ほるぷ出版,ほるぷ水族館えほん
ほるぷ出版,小さなひとりの大きなゆめ
ほるぷ出版,オリンポスの神々と７人の英雄
ほるぷ出版,月のひみつシリーズ
ほるぷ出版,火狩りの王
ほるぷ出版,ＮＨＫふつうってなんだろう？えほん
ほるぷ出版,教科書にでてくる地図記号
ほるぷ出版,Ｄａｙａｎ　ｉｎ　Ｗａｃｈｉｆｉｅｌｄ
ほるぷ出版,ＮＨＫ　Ｅテレ「Ｑ～こどものための哲学」
ほるぷ出版,ほるぷ創作絵本
ほるぷ出版,ちいちゃんえほん
ほるぷ出版,せいかつえほん
ほるぷ出版,声にだすことばえほん
ほるぷ出版,ワンダー
ほるぷ出版,パーシー・ジャクソンとオリンポスの神々
ほるぷ出版,見る知る考えるずかん
ほるぷ出版,めくって　たのしい　しかけえほん
ぼりゅうむわんプロダクツ,チェンジングブック
みくに出版,ＮＩＣＨＩＮＯＫＥＮ　ＢＯＯＫＳ
みくに出版,進学レーダーＢＯＯＫＳ
みくに出版,基本問題シリーズ
みくに出版,Ｎｉｃｈｉｎｏｋｅｎ　ｂｏｏｋｓ
みくに出版,日能研ブックス
みくに出版,算数基礎マスター
みくに出版,ウイニングステップ
みくに出版,チェックシリーズ
みくに出版,ウイニングステップシリーズ
みくに出版,中学入学試験問題集シリーズ
みくに出版,公立中高一貫校適性検査問題集シリーズ
みくに出版,漢字マスターシリーズ
みくに出版,一行計算問題集
みくに出版,マンガで算数シリーズ
アシーネ,おかあさんといっしょにシリーズ
アリス館,まあくんのバイバイあかちゃんシリーズ
アリス館,ぽかぽかえほん
アリス館,うららちゃんののりものえほん
アリス館,中川ひろたかのせいかつかがく絵本
アリス館,鳥のおはなし絵本
アリス館,ぐるぐるえほん
アリス館,うたってあそぼ
アリス館,あかちゃんのりものえほん
アリス館,やあ！出会えたね
アルク,こどもＳＴＥＡＭ
アルク,英語の達人になる！アルク学参シリーズ
アルク,英語の超人になる！アルク学参シリーズ
アーバン,語彙を増やすためのドリル
イカロス出版,イカロスＭＯＯＫ
イマジネイション・プラス,ｉｍａｇｉｎａｔｉｏｎ　ｕｎｌｉｍｉｔｅｄ
インプレス,ナショジオキッズ
インプレス,ｍｏｍｏ　ｂｏｏｋ
インプレス,はじめてのかがくのえほん
イーストプレス,こどもプレス
エムピージェー,水族館へ行こう！
エール出版社,ＹＥＬＬ　ｂｏｏｋｓ
エール出版社,Ｙｅｌｌ　ｂｏｏｋｓ
オライリー・ジャパン,Ｏ’ＲＥＩＬＬＹ　ＫＩＤＳ
オライリー・ジャパン,Ｍａｋｅ：Ｊａｐａｎ　Ｂｏｏｋｓ
オレンジページ,オレンジページムック
オーバーラップ,ポケモン空想科学読本
ガクジュツ,虎の巻シリーズ
ガクジュツ,高校入試虎の巻シリーズ
クレヨンハウス,クーヨンＢＯＯＫＳ
クレヨンハウス,落語絵本
クレヨンハウス,谷川俊太郎さんのあかちゃんから絵本
クレヨンハウス,谷川俊太郎のあかちゃんから絵本
クレヨンハウス,どうぶつ絵本
クレヨンハウス,干支セトラ絵本
クレヨンハウス,ぶたのぶたじろうさん
クレヨンハウス,大人は知らない・子どもは知りたい！
グラフィック社,すみっコぐらし
グランまま社,Ｂｏｏｋ　ｏｆ　ｓｅｎｓｅ　ｓｅｒｉｅｓ
グローバル教育出版,中学受験合格アプローチ
コクヨ,しかけえほんシリーズ
コクヨ,ＷＯＲＫ×ＣＲＥＡＴＥ
コクヨＳ＆Ｔ,Ａｒｔｓ　ａｎｄ　Ｃｒａｆｔｓシリーズ
コクヨＳ＆Ｔ,どうぶつ絵本
コクヨＳ＆Ｔ,ＷＯＲＫ×ＣＲＥＡＴＥシリーズ
コクヨＳ＆Ｔ,ＷＯＲＫ×ＣＲＥＡＴＥ
サニ－サイド,Ｓｕｎｎｙｓｉｄｅ　Ｂｏｏｋｓ
サンクチュアリ・パブリッシング,ぜったいに
サンマーク出版,ゲームブック
サンマーク出版,Ｂａｂｙ　Ｕｎｉｖｅｒｓｉｔｙ
サンマーク出版,ふってまわして
サンリオ,サンリオギフトブック
サンリオ,サンリオ
サンリード,創作えほん
ザメディアジョン,ポケットモンスター_幼
シルバーバック,七田式ｎｅｗ知力ドリル３・４歳
シルバーバック,七田式シリーズ
ジャムハウス,ジャムハウスの科学の本
スクウェア・エニックス,ドラゴンクエスト
スクウェア・エニックス,スライム
スクワッド,ＥＬＧＯＬＡＺＯ　ＢＯＯＫＳ
スタジオタック,はたらくくるま
スタジオタック,どうぶつ絵本
スタディカンパニー,みんなのゴロゴ
スタディカンパニー,ゴロゴシリーズ
スタディカンパニー,みんなのゴロゴ　極める古文問題集シリーズ
スタディカンパニー,新・ゴロゴシリーズ
スタディカンパニー,センター現代文一問一答問題集
スタディカンパニー,ゴロゴ板野の極める問題集シリーズ
スタディカンパニー,極める問題集シリーズ
スターツ出版,狼彼氏×天然彼女
スターツ出版,となりの一条三兄弟！
スターツ出版,ウタイテ！
スターツ出版,放課後★七不思議！
スターツ出版,爆発まで残り５分となりました
スターツ出版,交換ウソ日記
スターツ出版,溺愛１２０％の恋
スターツ出版,この恋は、ぜったいヒミツ。
スターツ出版,総長さま、溺愛中につき。
スターツ出版,リアルゲーム
スターツ出版,放課後図書室
スターツ出版,特等席はキミの隣。
スターツ出版,ヴァンパイア・溺愛パラダイス
スターツ出版,今日、キミに告白します
ソノリテ,ｍｏｎｏｇｏｎ
ダイヤモンド社,地球の歩き方ＢＯＯＫＳ
チャイルド本社,サンチャイルドビッグサイエンス
チャイルド本社,もこちゃんチャイルド
チャイルド本社,チャイルドブックアップル傑作選
チャイルド本社,もこちゃんチャイルド　うたのえほん
チャイルド本社,もこちゃんチャイルド　さわるえほん　４
チャイルド本社,もこちゃんチャイルド　まねっこえほん　７
チャイルド本社,チャイルド科学絵本館
チャイルド本社,わくわくチャレンジえほん
チャイルド本社,もこちゃんチャイルド　うたのえほん　８
チャイルド本社,もこちゃんチャイルド　おはなしえほん　３
チャイルド本社,新こども伝記ものがたり＜絵本版＞
チャイルド本社,大きな大きな絵本
チャイルド本社,チャイルドブックこども百科
チャイルド本社,「おやすみなさい」のお話集
チャイルド本社,サンチャイルド・ビッグサイエンス
チャイルド本社,おはなしチャイルド
チャイルド本社,チャイルドブックアップル
チャイルド本社,おはなしチャイルドリクエストシリーズ
テイエス企画,英語難関校受験シリーズ
ディスカヴァー・トゥエンティワン,おうちでＳＴＥＡＭ教育
ディスカヴァー・トゥエンティワン,考える力を育てる 天才ドリル
ディスカヴァー・トゥエンティワン,もいもい
ディスカヴァー・トゥエンティワン,ボードブック
デコ,からころ　ことばのおとのおもちゃばこ
データハウス,東京大学への道
トップスタジオＨＲ,世界と出会う絵本　イランの絵本
ナガセ,気鋭の講師
ナガセ,東進ブックス　レベル別問題集シリーズ
ナガセ,東進ブックス　大学受験高速マスターシリーズ
ナガセ,大学受験高速マスター
ナガセ,一目でわかるハンドブック
ナガセ,東進ブックス　高校生のドリル
ナガセ,東進新書
ナガセ,東進ブックス　大学受験レベル別問題集シリーズ
ナガセ,東進ブックス　名人の授業
ナガセ,《一歩先を行く》リーダードリル〈算数〉
ナガセ,東進ブックス
ナガセ,東進ブックス　大学受験一問一答シリーズ
ナガセ,東進ブックス　大学受験
ナガセ,名人の授業
ナガセ,ＦＯＲＭＵＬＡシリーズ
ナガセ,大学受験英文多読シリーズ
ナガセ,大学受験　名人の授業シリーズ
ナガセ,大学受験Ｃｏｒｅシリーズ
ナショナル出版,どうぶつ絵本
ナツメ社,キラかわ★ガール
ナツメ社,ナツメ社やる気ぐんぐんシリーズ
ナツメ社,こんちゅうずかん
ナツメ社,マジこわ！
ナツメ社,キラかわ☆ガール
ナツメ社,ナツメ社こどもブックス
ハッピーオウル社,おはなしのほん
ハッピーオウル社,しぜんのほん
ハート出版,親子で読む近現代史シリーズ
パイインターナショナル,いきものびっくりシリーズ
パイインターナショナル,日本の神話
パイインターナショナル,ＰＩＥのあかちゃんえほん
パイインターナショナル,うごかす！めくる！
パイインターナショナル,はじめてのおべんきょう
パイインターナショナル,手指をつかうしかけがいっぱい！
パブリブ,エロ語呂暗記法
パブリブ,大学入試問題問題シリーズ
ビリケン出版,Ｂｉｌｌｉｋｅｎ　ｂｏｏｋｓ
ビーエル出版,ぞうのエルマーシリーズ
ビーエル出版,イラスト地図で学ぶ　アトラス
ビーエル出版,お化けシリーズ
ビーエル出版,くまくまくんシリーズ
ビーエル出版,こねこの　きょうだい　かぞえうた
ビーエル出版,歴史たんけん
ビーエル出版,世界のむかしばなし
ビーエル出版,新宮晋のポップアップ絵本
ビーエル出版,ぞうのエルマー
ビーエル出版,ぞうのエルマーボードブック
ビーエル出版,グリム絵本
ビー・エヌ・エヌ,サンリオ
ピグマリオン,思考力想像力を育てるＰＹＧＬＩシリーズ
フォーラムＡ企画,１０分間ドリルシリーズ
フォーラムＡ企画,くりかえしシリーズ
フォーラムＡ企画,モノグラフ
フクト,にゅうけん２０２２
フクト,にゅうけん２０２１
フレーベル館,ＰＵＩ　ＰＵＩ　モルカー
フレーベル館,アンパンマンおままごとえほん
フレーベル館,アンパンマンのおはなしたんけん
フレーベル館,いつものおみせで！
フレーベル館,どこでもアンパンマン ミニブック
フレーベル館,それいけ！アンパンマン ゆびにんぎょうえほん
フレーベル館,アンパンマンマグネットブック
フレーベル館,こにぎりくん
フレーベル館,美術館公式「さがせ！」絵本
フレーベル館,ｉｉｉあいすくりん
フレーベル館,アンパンマン★スライドえほん
フレーベル館,アンパンマンあてっこ知育えほん
フレーベル館,アンパンマン音えほん
フレーベル館,アンパンマンのミニかたぬきえほん
フレーベル館,アンパンマンアニメギャラリー
フレーベル館,おでかけアンパンマン
フレーベル館,アンパンマンのちいさなずかん
フレーベル館,おはなしメルヘン　11
フレーベル館,それいけ！アンパンマン スーパーアニメブック
フレーベル館,家守神
フレーベル館,ベイビー・アンパンマン
フレーベル館,せなけいこのえほん
フレーベル館,できたよ！アンパンマン
フレーベル館,おやこでよもう！金子みすゞ
フレーベル館,フレーベル館はじめてうたえほん
フレーベル館,やなせたかしのあんぱんまん
フレーベル館,やなせたかしの名作えほん
フレーベル館,アンパンマンタイヤえほん
フレーベル館,アンパンマンはじめてのことばえほん
フレーベル館,はじめてのかがくえほん
フレーベル館,それいけ！アンパンマン　スーパーアニメブック
フレーベル館,わくわくメルヘンシリーズ
フレーベル館,アンパンマンわかるかな
フレーベル館,アンパンマンはじめまして
フレーベル館,アンパンマンおもしろブック
フレーベル館,それいけ！アンパンマン アニメえほん
フレーベル館,アンパンマンのぼうけん
フレーベル館,アンパンマンのミニシール
フレーベル館,アンパンマンのとびだすえほん
フレーベル館,アンパンマン_幼
フレーベル館,できたよ！ アンパンマン
フレーベル館,アンパンマンのことばえほん
フレーベル館,アンパンマンのかたぬきえほん
フレーベル館,フレーベル館の図鑑ナチュラ
フレーベル館,ふしぎコレクション
フレーベル館,アンパンマンとはじめよう！
フレーベル館,アンパンマンマグネットえほん
フレーベル館,アンパンマンドールブック
フレーベル館,アンパンマンのいない・いない・ばぁ
フレーベル館,アンパンマン　ミニしかけえほん
フレーベル館,ウォーリー
フレーベル館,リドルブックシリーズ
フレーベル館,アンパンマンのおはなしでてこい
フレーベル館,アンパンマンのクリスマスえほん
フレーベル館,アンパンマン
フレーベル館,フレーベルのえほん
フレーベル館,キンダーおはなしえほん傑作選
フレーベル館,ころころえほんぷち
フレーベル館,あかちゃんといっしょ０・１・２
フレーベル館,アンパンマンのあいうえおずかん
フレーベル館,アンパンマン_ミニずかん
フレーベル館,アンパンマンのしかけえほん
フレーベル館,ひきだしのなかの名作
フレーベル館,おはなしえほんシリーズ
フレーベル館,アンパンマン_ワークだいすき
ブックマン社,大学受験合格請負シリーズ超速ｔａｃｔｉｃｓ
ブックマン社,超明解！合格ＮＡＶＩシリーズ
ブックマン社,大学受験合格請負共通テスト対策シリーズ
ブックマン社,大学受験合格請負シリーズ
ブティック社,ブティック・ムック
ブティック社,ディズニー_ブティックムック
ブティック社,Ｂｏｕｔｉｑｕｅ　ｂｏｏｋｓ
ブティック社,ブティックムック
ブティック社,よい子とママのアニメ絵本
ブティック社,メイクアップファンタジーぬりえ
ブロンズ新社,ヨシタケシンスケ発想えほん
ブロンズ新社,しごとばシリーズ
