SHPNSHANM,SERIESNM
新興出版社啓林館,教科書ぴったりトレーニング
新興出版社啓林館,教科書ぴったりドリル
新興出版社啓林館,定期テストズバリよくでる
新評論,すこやかな生のための《Ｉ　ＡＭ　ＷＥＬＬＮＥＳＳ》絵本シリーズ
旅行読売出版社,たびよみ観光絵本
日本図書センター,学校では教えてくれない ピカピカ 自分みがき術
日本図書センター,こんなこいるかな 【新装版】
日本図書センター,こんなこいるかな
日本基督教団出版局,リトルベル
日本学習図書,小学校入試練習帳
日本学習図書,小学入試練習帳
日本学習図書,小学校別問題集
日本学習図書,分野別小学入試練習帳
日本学習図書,学校別問題集
日本学習図書,小学校別問題集首都圏版
日本学習図書,小学校別問題集近畿圏版
日本学習図書,小学校別問題集栃木県版
日本文芸社,実用ＢＥＳＴ　ＢＯＯＫＳ
日本文芸社,実用ｂｅｓｔ　ｂｏｏｋｓ
日本能率協会,モンテッソーリのせいかつえほん
日本能率協会マネジメントセンター,モンテッソーリのせいかつえほん
日東書院,ひとりでできる！Ｆｏｒ　Ｋｉｄｓ！！
日東書院,基礎がわかる！Ｆｏｒ　Ｋｉｄｓ！！
日栄社,発展３０日完成
日栄社,１０日で確認
日栄社,日栄社の薄物シリーズ
日栄社,集中２週間完成
日栄社,新・要説シリーズ
日栄社,毎年出るシリーズ
日栄社,１日１題・３０日完成
日栄社,書き込み式２０日間完成
日経ＢＰ,日経ＤＵＡＬの本
早川書房,絵本〈ピーターラビット〉
早川書房,ハヤカワ・ジュニア・ブックス
早川書房,ハヤカワ・ジュニア・サイエンス
早川書房,列車探偵ハル
早川書房,ミス・マープルの名推理
早川書房,名探偵ポアロ
早川書房,絵本ピーターラビット
早川書房,絵本　ピーターラビット
旺文社,学校では教えてくれない大切なこと
旺文社,ＹｏｕＴｕｂｅで学べる
旺文社,共通テストＣＲＯＳＳシリーズ
旺文社,大学受験ＳＵＰＥＲ　ＬＥＣＴＵＲＥ公民
旺文社,はじめての４技能まるごとトレーニング
旺文社,橋爪のこれだけで合格！シリーズ
旺文社,定期テスト やれば得点できるワーク
旺文社,高校入試対策
旺文社,中学入試 文章で答える問題の答え方がすっきりわかる
旺文社,大学入試合格のためのＴＥＡＰ対策書
旺文社,武田塾合格逆転一冊逆転プロジェクト
旺文社,大学受験スクランブル英文法・語法
旺文社,ランダム総点検
旺文社,基礎からのジャンプアップノート
旺文社,とってもやさしい
旺文社,高校入試 直前合格トレーニング 一問一答
旺文社,大学受験Ｄｏシリーズ
旺文社,中学入試丸暗記ノート
旺文社,中学入試自分でつくれるできる子ノート
旺文社,受験生の５０％以下しか解けない　差がつく入試問題
旺文社,マンガでわかる！中学入試に役立つ教養シリーズ
旺文社,ダジャレでおぼえる漢字とことば
旺文社,熟考シリーズ
旺文社,小学英語練習帳
旺文社,中学入試 用語＆資料集
旺文社,リビングドリル
旺文社,高校入試　中学１・２年の総復習
旺文社,高校入試 つまずき対策
旺文社,高校入試 入試問題で覚える 一問一答 
旺文社,高校入試 中学３年間の総復習
旺文社,中学準備さきどりノート
旺文社,大学受験ＳＵＰＥＲ　ＬＥＣＴＵＲＥ
旺文社,高校入試　とってもすっきり
旺文社,一問一答ターゲット
旺文社,標準問題精講シリーズ
旺文社,高校入試　合格でる順
旺文社,５教科まるごと　ごろ暗記シリーズ
旺文社,大学ｊｕｋｅｎ新書
旺文社,高校入試 自分でつくれるまとめノート
旺文社,高校入試　まぎらわしい用語　正解どっち？
旺文社,大学ＪＵＫＥＮ新書
旺文社,中学入試 くらべてわかるできる子図鑑
旺文社,定期テスト一問一答
旺文社,高校入試の基礎づくり
旺文社,高校とってもやさしい
旺文社,大学入試１０００熟語
旺文社,自分でつくれるまとめノート
旺文社,全国大学入試問題正解
旺文社,大学受験Ｄｏ　Ｓｅｒｉｅｓ
旺文社,大学入試苦手対策！
旺文社,教室シリーズ
旺文社,大学受験　受験スイッチが入る　基礎づくり
旺文社,大学受験Ｄｏ　Ｓｔａｒｔ
旺文社,古文・漢文教室シリーズ
旺文社,良問問題集
旺文社,大学入試即解セミナー
旺文社,高校入試きちんとこれだけ公立高校入試対策問題集
旺文社,中学 定期テストの対策ワーク
旺文社,受験生の５０％以上が解ける　落とせない入試問題
旺文社,飛び出せ高校生！
旺文社,高校総合的研究
昇龍堂出版,中学新Ａクラス問題集シリーズ
昇龍堂出版,昇竜堂の中学参考書
昇龍堂出版,Ａクラスブックス
明日香出版社,ＡＳＵＫＡ　ＣＵＬＴＵＲＥ
明日香出版社,Ａｓｕｋａ　ｂｕｓｉｎｅｓｓ＆ｌａｎｇｕａｇｅ　ｂｏｏｋｓ
明石書店,子どもの認知行動療法
星の環会,５つの風の絵ものがたり
星和書店,大人のための絵本
星雲社,ＰＡＲＡＤＥ　ＢＯＯＫＳ
星雲社,道徳えほん
星雲社,創作絵本シリーズ
星雲社,モモンガプレス
星雲社,おでかけＢＯＯＫ
星雲社,ＳＤＧｓシリーズ
星雲社,学べる絵本シリーズ
星雲社,緑新書
昭文社,まっぷるキッズ
朝日出版社,Ｍｉｎｉ　Ｄｉｃｔｉｏｎａｒｙ　Ｓｅｒｉｅｓ
朝日出版社,こども哲学
朝日学生新聞社,朝日小学生新聞の学習まんが
朝日学生新聞社,朝日小学生新聞の学習読み物
朝日学生新聞社,頭がよくなるパズルシリーズ
朝日学生新聞社,たくや式中学英語ノートシリーズ
朝日学生新聞社,朝日小学生新聞の学習シリーズ
朝日学生新聞社,朝日小学生新聞のドクガク！学習読みものシリーズ
朝日学生新聞社,ひとりで学べる
朝日学生新聞社,かずお式中学数学ノート
朝日新聞出版,サバイバルシリーズ
朝日新聞出版,未来のキミのためシリーズ
朝日新聞出版,夢の仕事場
朝日新聞出版,あした話したくなる
朝日新聞出版,ＡＥＲＡ　ＭＯＯＫ
朝日新聞出版,なぞ解きサバイバルシリーズ
朝日新聞出版,ワクワク知育ＢＯＯＫ
朝日新聞出版,歴史漫画タイムワープシリーズ
朝日新聞出版,脳科学にもとづいた知育絵本
朝日新聞出版,歴史漫画サバイバル
朝日新聞出版,かがくるＢＯＯＫ
朝日新聞出版,ＱｕｉｚＫｎｏｃｋの課外授業シリーズ
朝日新聞出版,音でる♪知育絵本
朝日新聞出版,読むＣ☆ＳＣＨＯＯＬ
朝日新聞出版,Ｃ　ＳＣＨＯＯＬ
朝日新聞出版,Ａｓａｈｉ　Ｊｕｎｉｏｒ　Ｇａｋｕｓｈｕ　Ｐｏｓｔｅｒ　Ｂｏｏｋ
朝日新聞出版,今解き教室シリーズ別冊
朝日新聞出版,今解き教室サイエンス
朝日新聞出版,科学探偵謎野真実シリーズ
朝日新聞出版,トキメキ知育ＢＯＯＫ
朝日新聞出版,光る★音でる♪知育絵本
東京出版,高校への数学
東京出版,プレ１対１シリーズ
東京出版,教科書Ｎｅｘｔ
東京出版,中・高一貫シリーズ
東京出版,１対１シリーズ
東京創元社,妖怪の子預かります
東京化学同人,化学演習シリーズ
東京大学出版会,現役東大生がつくる東大受験本
東京子ども図書館,おはなしのろうそく
東京学参,中学別入試過去問題シリーズ
東京学参,公立中高一貫校シリーズ
東京学参,高校入試実戦シリーズ
東京学参,公立高校入試シリーズ
東京学参,公立中高一貫校入試シリーズ
東京学参,高校入試特訓シリーズ
東京学参,高校別入試過去問題シリーズ
東京書店,はじめての絵の具遊び
東京書店,わくわく音あそびえほん
東京書店,あそべるポップアップえほん
東京書店,とびだすえほん
東京書店,日本の神様のお話
東京書店,さわってあそぶ知育絵本
東京書店,さがしてたのしい知育絵本
東京書店,へんしんパズルえほん
東京書店,どうぶつたっち
東京書店,すみっコぐらし
東京書店,メイクアップぬりえＢＯＯＫ
東京書籍,Ｕ１８　世の中ガイドブック
東京書籍,小学生のための英語絵本シリーズ　Ｏｖｅｒ　ｔｈｅ　ＮＥＷ　Ｈ
東京書籍,トーマス
東洋館出版社,おかしっこ学校はじめ組
東洋館出版社,お医者さんが考えた認知機能を育むえほんコグトレ
東洋館出版社,学校がもっとすきになるシリーズ
東洋館出版社,学校がもっとすきになる絵本シリーズ
東邦出版,アインシュタイン式子供の論理脳ドリルシリーズ
桐原書店,実戦演習レベル別問題集
桐原書店,完全征服シリーズ
桐原書店,実戦演習
桐原書店,大学受験スーパーゼミ徹底攻略
桐原書店,まるまる使える
桐原書店,新版完全制服
桐原書店,即戦ゼミ
桐原書店,短期で攻める
桐原書店,大学受験スーパーゼミ
桐原書店,新版完全征服
桐原書店,データベース
桐原書店,ハイパー英語教室
桐杏学園出版,国立・私立小学校入試
桐杏学園出版,小学校入試対策問題集　キリトリ式
横浜アニメーションラボ,ＹＡＭＡＶＩＣＯ　ＨＡＵＳ
水王舎,ただよび大学受験シリーズ
水王舎,出口式みらい学習ドリル
水王舎,出口先生の頭がよくなる漢字シリーズ
水王舎,読む力・書く力をぐんぐんのばす
永岡書店,クレヨンしんちゃん
永岡書店,めくって発見！えほん
永岡書店,とびだすえほん
永岡書店,０・１・２さいぬのえほん
永岡書店,ぐんぐん脳が育つ知育ドリル
永岡書店,親子で楽しむしかけえほん
永岡書店,トロールズ
永岡書店,大人だって本当は知らない
永岡書店,仮面ライダー
永岡書店,マンガでわかる
永岡書店,０・１・２さいあかちゃんえほん
永岡書店,なかよし写真えほん
永岡書店,トミカ
永岡書店,日本昔ばなしシリーズ
永岡書店,ＩＱ・ＥＱ開発シリーズ
永岡書店,Ｎａｇａｏｋａ知育ドリル
永岡書店,ＮＡＧＡＯＫＡ知育ドリル
永岡書店,こども写真ひゃっか
永岡書店,新・知力開発シリーズ
永岡書店,ちびまる子ちゃん
永岡書店,ディズニー
永岡書店,ディズニーゴールデンコレクション
永岡書店,よいこのおりがみシリーズ
永岡書店,たのしいポップアップえほん
永岡書店,こころをはぐくむふれあいえほん
永岡書店,トーマス
永岡書店,保育園・幼稚園の先生とつくった
永岡書店,名作かみしばいシリーズ
永岡書店,シンデレラ
永岡書店,指人形えほん
永岡書店,ディズニージグソーブック
永岡書店,プラレール
永岡書店,たのしいあやとりシリーズ
永岡書店,日本昔ばなしアニメ絵本
永岡書店,わらってみにつくしかけえほん
永岡書店,まどあきしかけえほん
永岡書店,ディズニープレミアム・コレクション
永岡書店,スライド知育しかけえほん
永岡書店,ポップアップ絵本
永岡書店,ポップアップおはなしえほん
永岡書店,とびだすミニえほん
永岡書店,はたらくくるま
永岡書店,ミニオンズ
永岡書店,ドリームワークス・コレクション
永岡書店,ディズニー・プレミアム・コレクション
永岡書店,世界名作アニメ絵本
永岡書店,ディズニー・ゴールデンシリーズ
永岡書店,ディズニー・ゴールデン・コレクション
永岡書店,ディズニー_愛蔵版ディズニー絵本
汐文社,えほん遠野物語　第三期
汐文社,えほんミニオンズ第３期
汐文社,こころのえ？ほん
汐文社,えほん遠野物語
汐文社,ミニオンズ
汐文社,意味がわかるとゾッとする話３分後の恐怖
汐文社,身近な生き物　淡水魚・淡水生物
汐文社,はじめて読む　科学者の伝記
汐文社,ジュニア　空想科学読本＜愛蔵版＞
汐文社,きみを変える５０の名言
池田書店,なぜ？どうして？生活のふしぎ
池田書店,本当にあった怖い話
河出書房新社,話５分シリーズ＋
河出書房新社,５分シリーズ＋
河出書房新社,５分シリーズ
河出書房新社,わくわく発見！
河出書房新社,１４歳の世渡り術
河出書房新社,マンガでわかる！　１０代からのビジネスブック
河出書房新社,世界名作プリンセス絵本
河出書房新社,トムとジェリー
河出書房新社,チコっと古典シリーズ
河合出版,英語入試問題解法の王道　２
河合出版,土曜日に差がつく
河合出版,河合塾ＳＥＲＩＥＳ
河合出版,マーク式基礎問題集２０
河合出版,入試精選問題集
清水書院,ＣＯＬＯＲ　ＬＥＣＴＵＲＥ
清水書院,日本大学付属高等学校等基礎学力到達度テスト
清水書院,完全ＭＡＳＴＥＲ
清水書院,メモリーバンク
清風堂書店,教科書レベルの力がつく！
清風堂書店,単元別まるわかり！シリーズ
清風堂書店出版部,単元別まるわかり！シリーズ
潮出版社,アグネス・チャン親子で読む絵本
瀬谷出版,大学受験絶対合格Ｖシリーズ
熊本ネット,合格できるシリーズ
熊本ネット,合格できる問題集
熊本ネット,合格できる
玄光社,ディズニー
玉川大学出版部,日本の伝記　知のパイオニア
玉川大学出版部,未来への記憶
玉川大学出版部,ＹＯＵＮＧ　ＡＤＵＬＴ　ＡＣＡＤＥＭＩＣ　ＳＥＲＩＥＳ
現代企画室,末盛千枝子ブックス
理論社,伝説の化石ハンター
理論社,ヌラリヒョン・パパにまかせなさい！
理論社,どうぶつおりがみ
理論社,江戸のなぞなぞ　なぞかけランド
理論社,３分後にゾッとする話世界
理論社,本屋さんのルビねこ
理論社,みけねえちゃんにいうてみな
理論社,３分後にゾッとする話
理論社,りっぱな犬になる方法
理論社,ショートセレクション
理論社,世界ショートセレクション
理論社,ホンこわ！
理論社,妖怪一家九十九さん
理論社,西遊記
理論社,１００円グッズでできる工作＆実験ブック
理論社,新・王さまえほん
理論社,西遊後記
理論社,絵本「クマのパディントン」シリーズ
理論社,怖い話
理論社,よわむしおばけ
理論社,王さま
理論社,１０分スイーツ１００円ラッピング
理論社,おかしのくにのプリンちゃん
理論社,まどみちおの絵本
理論社,どうぶつ絵本
理論社,理論社版新しい絵本
理論社,理論社のようねんどうわ
理論社,パンダのポンポン
理論社,たまごやき
理論社,ともだちは海のにおい
瑞雲舎,翻訳絵本シリーズ
白夜書房,白夜ムック
白泉社,ノラネコぐんだん
白泉社,コドモエの本
白泉社,コドモエのえほん
白泉社,ｋｏｄｏｍｏｅのえほん
白泉社,こどもＭＯＥのえほん
白泉社,ＭＯＥ　ＢＯＯＫＳ
白泉社,Ｍｏｅ　ｂｏｏｋｓ
白泉社,ＭＯＥのえほん
真珠書院,教科書完全攻略問題集
研究社出版,Ｋｅｎｋｙｕｓｈａ・ｓ　ｎａｖｉ　ｓｅｒｉｅｓ
福音館書店,あーんあんの絵本
福音館書店,こどものとも日本の昔話１０のとびら
福音館書店,赤毛のゾラ
福音館書店,世界傑作絵本シリーズ　カナダの絵本
福音館書店,ピーターラビットの絵本
福音館書店,いきものづくし ものづくし
福音館書店,世界傑作絵本シリーズ　オランダの絵本
福音館書店,こどものとも絵本
福音館書店,グリムの昔話
福音館書店,安野光雅の絵本
福音館書店,てんじつきさわるえほん
福音館書店,タンタンの冒険
福音館書店,みるずかん・かんじるずかん＜銀の本＞
福音館書店,世界傑作童話シリーズ
福音館書店,かがくのとも特製版
福音館書店,福音館あかちゃんの絵本
福音館書店,幼児絵本シリーズ
福音館書店,福音館のかがくのほん
福音館書店,創作童話シリーズ
福音館書店,いやだいやだの絵本
福音館書店,ハイジ
福音館書店,海底二万海里
福音館書店,福音館の科学シリーズ
福音館書店,安野光雄の絵本
福音館書店,おでかけばいばいのほん
福音館書店,ガリヴァー旅行記
福音館書店,二年間の休暇
福音館書店,北の森の十二か月
福音館書店,不思議の国のアリス
福音館書店,びじゅつのゆうえんち
福音館書店,みるずかん・かんじるずかん　金の本
福音館書店,ピーターラビットの絵本　１
福音館書店,幼児絵本ふしぎなたねシリーズ
福音館書店,みつけようかがく
福音館書店,こどものとも年少版劇場
福音館書店,ランドセルブックス
福音館書店,ピーターラビット
福音館書店,英語でたのしむ 福音館の絵本
福音館書店,あそびのこばこ
福音館書店,かがみのえほん
福音館書店,ブルーナの絵本
福音館書店,エルマーとりゅう
福音館書店,みぢかなかがく
福音館書店,もりのおくりもの
福音館書店,かがくのとも傑作集　わいわいあそび
福音館書店,ブルーナのうたこさんのえほん
福音館書店,西遊記
福音館書店,ブルーナのゆかいななかま
福音館書店,こどものとも劇場
福音館書店,こどものともコレクション
福音館書店,かがくのとも傑作集　どきどきしぜん
福音館書店,福音館のペーパーバック絵本
福音館書店,魔女の宅急便
福音館書店,語りつぐ人びと
福音館書店,福音館の単行本
福音館書店,かがくのほん
福音館書店,はじめてであうずかん
福音館書店,みるずかん・かんじるずかん＜金の本＞
福音館書店,写真記シリーズ
福音館書店,タンタンの冒険旅行
福音館書店,世界傑作絵本シリーズ
福音館書店,かがくのとも絵本
福音館書店,福音館の科学の本
福音館書店,ブルーナのたのしいべんきょう
福音館書店,こどものともセレクション
福音館書店,だるまちゃんの絵本
福音館書店,日本傑作絵本シリーズ
福音館書店,ぐりとぐら
福音館書店,くまくんの絵本
福音館書店,子どもがはじめてであう絵本
福音館書店,世界傑作絵本シリーズ　アメリカの絵本
福音館書店,かがくのとも傑作集
福音館書店,福音館創作童話シリーズ
福音館書店,たくさんのふしぎ傑作集
福音館書店,福音館古典童話シリーズ
福音館書店,０．１．２．えほん
福音館書店,谷川俊太郎の科学絵本
福音館書店,パディントン
福音館書店,ばばばあちゃんの絵本
秀英予備校,秀英ＢＯＯＫＳ
秀英予備校,秀英ＢＯＯＫＳ　秀英ライナー
童心社,ピーマン村の絵本たち
童心社,せなけいこおばけえほん
童心社,いしかわこうじしかけえほん
童心社,松谷みよ子むかしむかし
童心社,かわいいむしのえほん
童心社,かこさとし・からだの本
童心社,絵本こどものひろば
童心社,ももんちゃん
童心社,怪談レストラン
童心社,てんじつきさわるえほん
童心社,かこさとしからだの本
童心社,母と子のえほん
童心社,年少向けおひさまこんにちは
童心社,食育かみしばいおいしいね、うれしいね！
童心社,世界のおはなし傑作選
童心社,童心社のベスト紙芝居
童心社,あいさつしかけえほん
童心社,まついのりこ・かみしばいひろがるせかい
童心社,かみしばいなぜ？どうして？たのしい行事
童心社,童心社のかみしばい
童心社,まついのりこかみしばいひろがるせかい
童心社,怪談オウマガドキ学園
童心社,松谷みよ子あかちゃんの本
童心社,よんでよんでのえほん
童心社,絵本・ぼくたちこどもだ
童心社,絵本・ちいさななかまたち
童心社,１４ひきのシリーズ
童心社,絵本ぼくたちこどもだ
童心社,あかちゃんととととと
童心社,絵本・こどものひろば
童心社,くれよんのくろくん
童心社,ちいさないきものずかん
童心社,むしのたまごシリーズ
童心社,猫町ふしぎ事件簿
童心社,どうぶつ絵本
童心社,たのしいいちにち
童心社,のりものしかけえほん
童心社,ちいさなしかけえほん
童心社,ピーマン村のおともだち
童心社,どーんとやさい
童心社,あかちゃんのおいしい本
童心社,とことこえほん
童心社,おいしいともだち
童心社,ふうとはなの絵本
童心社,ほのぼの新美南吉ランド
童心社,いきもの　みーつけた
童心社,五味太郎　おでかけシリーズ
童心社,かわいいいきもののえほん
童心社,ばななせんせいのほん
童心社,復刊傑作絵本ことばと詩のえほん
童心社,せとうちたいこさんシリーズ
童心社,たばたせいいちの絵本
童心社,馬場のぼる　へんてこあそびえほん
童心社,２０２１年度定期紙芝居　年少向け　おひさまこんにちは
童心社,ももんちゃんあそぼう
童心社,怪談レストランナビ
童心社,ことばとからだであそぼう！　かみしばい２・３歳児のふれあいあ
童心社,童心社のおはなしえほん
童心社,あかちゃんかみしばい
童心社,みんないっしょに、うれしいな！
童心社,かみしばい世界の名作劇場
童心社,松谷みよ子おはなし珠玉選
童心社,おひさまこんにちは年少向
童心社,ともだちだいすき
童心社,２０２１年度定期紙芝居　ともだちだいすき
童心社,おひさまこんにちは
童心社,童心社の絵本
童心社,怪談・オウマガドキ学園＜図書館版＞
童心社,ハートウッドホテル
童心社,クローバーと魔法動物
童心社,はんぴらり！＜増補新版＞
童心社,シェーラ姫の冒険＜愛蔵版＞
童心社,ぴよぴよシリーズ
童心社,手塚治虫からの伝言
童心社,ＳＤＧｓでかんがえよう　地球のごみ問題
童心社,性とからだの絵本
童心社,かんぱい！
童心社,１４ひきのポケットえほん
童心社,シートン動物記
童心社,雨ふる本屋
童心社,日中韓平和絵本
童心社,若い人の絵本
童心社,ちいさな〈せなけいこ・おばけえほん〉
童心社,松谷みよ子民話珠玉選
童心社,そうべえ
童心社,新シェーラ姫の冒険＜愛蔵版＞
童心社,わらべうたでひろがるあかちゃん絵本
童心社,なぞなぞコレクション
童話屋,あかちゃん絵本
童話屋,ねずみのほん
童話屋,美しい数学
童話館出版,こぶたくんのおはなしシリーズ
竹書房,マインクラフト難破船と人魚の秘密
竹書房,ディズニー・アニメ・デラックス絵本
竹書房,学校のコワイうわさ　新・花子さんがきた！！
竹書房,ディズニーデラックス絵本
竹書房,まほうのレシピ
竹書房,マインクラフト
絵本塾出版,いきるよろこびシリーズ
絵本塾出版,翻訳絵本
絵本塾出版,シリーズれきしをまなぶ
絵本塾出版,いきるよろこび
絵本塾出版,北の森の動物たちシリーズ
絵本塾出版,創作絵本
絵本塾出版,創作えほん
緑書房,日本のいきものビジュアルガイド
美術出版社,ミッフィー
群羊社,たべもの・食育絵本
翔泳社,ぼうけんキッズ
自由国民社,地雷撤去キャンペーン絵本シリーズ
自由国民社,お父さんが教えるシリーズ
至光社,至光社ブッククラブ国際版絵本
至光社,国際版絵本
至光社,ブッククラブ
致知出版社,心に響く小さな５つの物語
英俊社,中学入試合格トレインシリーズ
英俊社,公立高校入試対策シリーズ
英俊社,近道問題シリーズ
英俊社,最難関高校シリーズ
英俊社,難関中学シリーズ
英俊社,公立高校入試予想テストシリーズ
英俊社,中学校別入試対策シリーズ
英俊社,高校別入試対策シリーズ
英俊社,近畿の中学入試シリーズ
英俊社,近畿の高校入試シリーズ
草思社,声に出して読みたい・こどもシリーズ
草思社,なぞぺーシリーズ
草炎社,そうえん社写真のえほん
草炎社,大草原の小さな家
草炎社,ケロちゃんえほん
草炎社,しぜんといっしょ
草炎社,そうえんしゃ日本のえほん
西東社,ミラクルハッピー☆希望のどうぶつ物語
