JAN,SHOSINM,KANSU,ITMCD,DAIGENRECD,CHUGENRECD,SHOGENRECD,SIKIRIBANCD,ITMNM,DAIGENRENM,CHUGENRENM,SHOGENRENM,SIKIRIBANNM,CHOSHANM,SHPNSHACD,SHPNSHANM,SAKUHINCD,SAKUHINNM,SOSHONM,HATUBAIYMD,ANNUAL_SALES,SUBLABEL,SERIESNM
9784577051061,ブンブーン！バイキンメカ,,1076,16,0021,0001,0001,書籍,児童書,キャラクター絵本,キャラクター絵本,アンパンマン,やなせたかし,0000577,フレーベル館,43376238,ブンブーン！バイキンメカ,［バラエティ］　アンパンマンタイヤえほん,20221021,1123,アンパンマンタイヤえほん,アンパンマンタイヤえほん
9784591175200,ウルトラマン大図鑑ハイパー,,1076,16,0021,0001,0041,書籍,児童書,キャラクター絵本,キャラクター絵本,ヒーロー,円谷プロダクション,0000591,ポプラ社,43376319,ウルトラマン大図鑑ハイパー,,20221122,2825,単行本,ウルトラマン
9784591175651,トミカコレクション　２０２３,,1076,16,0021,0001,0055,書籍,児童書,キャラクター絵本,キャラクター絵本,超ひみつゲット,タカラトミー,0000591,ポプラ社,43380018,トミカコレクション　２０２３,超ひみつゲット！,20221207,3702,超ひみつゲット！,超ひみつゲット
9784592763123,おすしがふくをかいにきた,,1076,16,0007,0001,0092,書籍,児童書,絵本,国内絵本,国内絵本,田中達也,0000592,白泉社,43357122,おすしがふくをかいにきた,ＭＯＥのえほん,20221003,5809,,ＭＯＥのえほん
9784592763147,いちごサンタ,,1076,16,0007,0001,0092,書籍,児童書,絵本,国内絵本,国内絵本,わたなべあや,0000592,白泉社,43368307,いちごサンタ,コドモエの本,20221101,1529,,コドモエの本
9784591175422,なにかな？　まる　あかまるの　かたちえほん,,1076,16,0011,0003,0001,書籍,児童書,幼児絵本,知育絵本,知育絵本,しみずだいすけ,0000591,ポプラ社,43372099,なにかな？　まる　あかまるの　かたちえほん,０歳からのあかちゃんえほん,20221104,1159,０歳からのあかちゃんえほん,０歳からのあかちゃんえほん
9784591175668,プラレールコレクション　２０２３,,1076,16,0021,0001,0055,書籍,児童書,キャラクター絵本,キャラクター絵本,超ひみつゲット,タカラトミー,0000591,ポプラ社,43380019,プラレールコレクション　２０２３,超ひみつゲット！,20221207,2109,超ひみつゲット！,超ひみつゲット
9784577051054,ゴーゴー！アンパンマンごう,,1076,16,0021,0001,0001,書籍,児童書,キャラクター絵本,キャラクター絵本,アンパンマン,やなせたかし,0000577,フレーベル館,43365400,アンパンマンタイヤえほん,［バラエティ］　アンパンマンタイヤえほん,20221021,2209,アンパンマンタイヤえほん,アンパンマンタイヤえほん
9784577051092,めくってだあれ？,,1076,16,0021,0001,0001,書籍,児童書,キャラクター絵本,キャラクター絵本,アンパンマン,やなせたかし,0000577,フレーベル館,43372092,めくってだあれ？,ベイビー・アンパンマン,20221128,2163,ベイビー・アンパンマン,ベイビー・アンパンマン
9784591175002,黒田長政　戦国人物伝　日本の歴史＜コミック版＞８３,,1076,16,0071,0005,0041,書籍,児童書,学習百科,学習漫画,偉人・伝記（漫画）,加来耕三,0000591,ポプラ社,43367771,黒田長政　戦国人物伝　日本の歴史＜コミック版＞８３,,20221013,1056,コミック版　日本の歴史,コミック版　日本の歴史
9784591175637,アナと雪の女王まちがいさがし　エルサのプレゼント,,1076,16,0021,0001,0005,書籍,児童書,キャラクター絵本,キャラクター絵本,ディズニー,ｍｉｏ,0000591,ポプラ社,43380016,アナと雪の女王まちがいさがし　エルサのプレゼント,,20221207,1656,単行本,ディズニー
9784774622767,れいぞうこのそこのそこ　りんごのまほう,,1076,16,0007,0001,0097,書籍,児童書,絵本,国内絵本,３才〜国内絵本,うえだしげこ,0007746,教育画劇,43359665,れいぞうこのそこのそこ　りんごのまほう,れいぞうこのあるあるえほん,20221006,1353,れいぞうこのあるあるえほん,れいぞうこのあるあるえほん
9784774622859,おばけのやだもん　だいすき！ソフトクリーム,,1076,16,0007,0001,0092,書籍,児童書,絵本,国内絵本,国内絵本,ひらのゆきこ,0007746,教育画劇,43375642,おばけのやだもん　だいすき！ソフトクリーム,,20230112,1132,おばけのやだもん　えほんシリーズ,おばけのやだもん
9784774333335,５さいからできる　おかね　はじめて編,,1076,16,0071,0001,0007,書籍,児童書,学習百科,学習百科,道徳・教養,白井一之,0007743,くもん出版,43366183,５さいからできる　おかね　はじめて編,シールたっぷりレッスン,20221202,1869,シールたっぷりレッスン,シールたっぷりレッスン
9784774333366,４さいからできる　えいご,,1076,16,0071,0001,0006,書籍,児童書,学習百科,学習百科,英語,卯城祐司,0007743,くもん出版,43366186,４さいからできる　えいご,シールたっぷりレッスン,20221202,1319,シールたっぷりレッスン,シールたっぷりレッスン
9784774333342,５さいからできる　プログラミング,,1076,16,0071,0001,0009,書籍,児童書,学習百科,学習百科,プログラミング,中村一彰,0007743,くもん出版,43366184,５さいからできる　プログラミング,シールたっぷりレッスン,20221202,1675,シールたっぷりレッスン,シールたっぷりレッスン
9784774333359,４さいからできる　しぜんとかがく,,1076,16,0071,0001,0004,書籍,児童書,学習百科,学習百科,理科,横山正,0007743,くもん出版,43366185,４さいからできる　しぜんとかがく,シールたっぷりレッスン,20221202,1363,シールたっぷりレッスン,シールたっぷりレッスン
9784815429812,愛知県公立高予想テスト　２０２３年度受験用,,1076,19,0021,0061,0011,書籍,学習参考書,中学学参,高校入試,学校別問題集,英俊社編集部,0008154,英俊社,43372163,愛知県公立高予想テスト　２０２３年度受験用,公立高校入試予想テストシリーズ,20221110,1381,公立高校入試予想テストシリーズ,公立高校入試予想テストシリーズ
9784834086850,でんしゃが　きた！,,1076,16,0007,0005,0001,書籍,児童書,絵本,福音館書店,福音館書店,石橋真樹子,0008340,福音館書店,43365884,でんしゃが　きた！,幼児絵本ふしぎなたねシリーズ,20221107,1030,幼児絵本ふしぎなたねシリーズ,幼児絵本ふしぎなたねシリーズ
9784866515816,うんこドリル　たしざん・ひきざんもんだいしゅう編小学１年生　日本一楽しい学習ドリル,,1076,19,0005,0001,0051,書籍,学習参考書,小学ドリル,小学ドリル,うんこドリル,古屋雄作,0086651,文響社,43367358,うんこドリル　たしざん・ひきざんもんだいしゅう編小学１年生　日本一楽しい学習ドリル,うんこドリル算数,20221110,1667,小学生 ドリル 1年生,うんこドリル_小
9784815429836,兵庫県公立高予想テスト　２０２３年度受験用,,1076,19,0021,0061,0011,書籍,学習参考書,中学学参,高校入試,学校別問題集,英俊社編集部,0008154,英俊社,43372165,兵庫県公立高予想テスト　２０２３年度受験用,公立高校入試予想テストシリーズ,20221110,1141,公立高校入試予想テストシリーズ,公立高校入試予想テストシリーズ
9784866515830,うんこドリル　小学１ー６年生の全漢字,,1076,19,0005,0001,0051,書籍,学習参考書,小学ドリル,小学ドリル,うんこドリル,古屋雄作,0086651,文響社,43367360,うんこドリル　小学１ー６年生の全漢字,,20221110,1150,小学生 ドリル,うんこドリル_小
9784890859078,東進共通テスト実戦問題集英語［リーディング］〈２訂版〉,,1076,19,0031,0051,0031,書籍,学習参考書,高校学参,予備校,東進ハイスクール,安河内哲也,0089085,ナガセ,43367862,東進共通テスト実戦問題集英語［リーディング］〈２訂版〉,東進ブックス,20221108,1146,,東進ブックス
9784866515311,１日１まい　３０日うんこドリル　かん字　小学１年生,,1076,19,0005,0001,0051,書籍,学習参考書,小学ドリル,小学ドリル,うんこドリル,古屋雄作,0086651,文響社,43335805,１日１まい　３０日うんこドリル　かん字　小学１年生,,20221005,1238,小学生 ドリル 1年生,うんこドリル_小
9784815429829,大阪府公立高等学校一般予想テスト　２０２３年度受験用,,1076,19,0021,0061,0011,書籍,学習参考書,中学学参,高校入試,学校別問題集,ｍｉｏ,0008154,英俊社,43372164,大阪府公立高等学校一般予想テスト　２０２３年度受験用,公立高校入試予想テストシリーズ,20221102,1402,公立高校入試予想テストシリーズ,公立高校入試予想テストシリーズ
9784862904089,Ｚ会小学生わくわくワーク６年生総復習・中学さきどり編　２０２２・２０２３年度用　国語・算数・理科・社会・英語,,1076,19,0011,0005,0021,書籍,学習参考書,小学学参,基礎学習,総復習,Ｚ会編集部,0086290,Ｚ会編集部,43374294,Ｚ会小学生わくわくワーク６年生総復習・中学さきどり編　２０２２・２０２３年度用　国語・算数・理科・社会・英語,,20221108,1296,,わくわくワーク
9784866515823,うんこドリル　たし算・ひき算・かけ算もんだいしゅう編小学２年生　日本一楽しい学習ドリル,,1076,19,0005,0001,0051,書籍,学習参考書,小学ドリル,小学ドリル,うんこドリル,古屋雄作,0086651,文響社,43367359,うんこドリル　たし算・ひき算・かけ算もんだいしゅう編小学２年生　日本一楽しい学習ドリル,うんこドリル算数,20221110,1148,小学生 ドリル 2年生,うんこドリル_小
9784575317619,先生は教えてくれない！クレヨンしんちゃんの折れない心をつくる本,,1076,16,0071,0005,0091,書籍,児童書,学習百科,学習漫画,その他学習漫画,臼井儀人,0000575,双葉社,43366747,先生は教えてくれない！クレヨンしんちゃんの折れない心をつくる本,,20221117,2054,,
9784410105883,チャート式基礎からの数学２＋Ｂ　新課程,,1076,19,0031,0011,0011,書籍,学習参考書,高校学参,数学,数学Ⅱ・Ｂ,チャート研究所,0000410,数研出版,43371514,チャート式基礎からの数学２＋Ｂ　新課程,,20221025,2595,,
9784046321657,君のとなりで。　この道を、ずっといっしょに,９,1076,16,0055,0001,0015,書籍,児童書,児童文庫,児童文庫,角川つばさ文庫,高杉六花,0000004,ＫＡＤＯＫＡＷＡ,43090241,君のとなりで。,角川つばさ文庫,20221013,2147,,
9784299036124,ドラゴン超絶バトル大図鑑,,1076,16,0061,0001,0091,書籍,児童書,実用百科,実用百科,その他実用百科,村上健司,0000299,宝島社,43373399,ドラゴン超絶バトル大図鑑,,20221024,1105,,
9784863463417,２０２３年中学入試用サピックス重大ニュース　中学入試に出る　２０２２ニュース解説（小学５・６年,,1076,19,0011,0061,0003,書籍,学習参考書,小学学参,中学入試,重大ニュース,進学教室サピックス小学部,0086346,代々木ライブラリー,43368312,２０２３年中学入試用サピックス重大ニュース　中学入試に出る　２０２２ニュース解説（小学５・６年,,20221101,2643,,
9784591175514,おかあさんといっしょ　おうたで　わーい！,,1076,16,0015,0001,0001,書籍,児童書,しかけ絵本,しかけ絵本,音のでる絵本,ｍｉｏ,0000591,ポプラ社,43380292,おかあさんといっしょ　おうたで　わーい！,,20221209,4774,単行本,
9784834767544,わくわく楽しい！日本＆世界の旅行すごろく,,1076,16,0091,0001,0006,書籍,児童書,グッズ,グッズ,すごろく,ｍｉｏ,0008347,ブティック社,43375238,わくわく楽しい！日本＆世界の旅行すごろく,［バラエティ］,20221220,1061,,
9784284001205,いちねんせいえほん　はじめての「よのなかルールブック」,,1076,16,0011,0003,0001,書籍,児童書,幼児絵本,知育絵本,知育絵本,高濱正伸,0000284,日本図書センター,43383708,いちねんせいえほん　はじめての「よのなかルールブック」,,20230118,4953,,
9784046322210,おもしろい話、集めました。Ｗ,,1076,16,0055,0001,0015,書籍,児童書,児童文庫,児童文庫,角川つばさ文庫,ひのひまり,0000004,ＫＡＤＯＫＡＷＡ,43383192,おもしろい話、集めました。Ｗ,角川つばさ文庫,20230112,1800,,
9784342353697,重要古文単語３１５　読んで見て聞いて覚える　四訂版,,1076,19,0031,0015,0031,書籍,学習参考書,高校学参,国語,古文・古典,武田博幸,0000342,桐原書店,43370958,重要古文単語３１５　読んで見て聞いて覚える　四訂版,,20221014,2377,,
9784065302576,超復刻版　タローマンかるた,,1076,16,0091,0001,0005,書籍,児童書,グッズ,グッズ,かるた,ＮＨＫ「ＴＡＲＯＭＡＮ」制作班,0000006,講談社,43370941,超復刻版　タローマンかるた,［バラエティ］,20221205,1071,,
9784046321862,恐怖コレクター　宿命の再会,２０,1076,16,0055,0001,0015,書籍,児童書,児童文庫,児童文庫,角川つばさ文庫,佐東みどり,0000004,ＫＡＤＯＫＡＷＡ,42675589,恐怖コレクター,角川つばさ文庫,20221214,3491,,
9784265081899,いつつごうさぎとゆきのもり,,1076,16,0007,0001,0097,書籍,児童書,絵本,国内絵本,３才〜国内絵本,まつおりかこ,0000265,岩崎書店,43377202,いつつごうさぎとゆきのもり,,20221207,9321,,
9784300104125,自分のあたまで考えるドリル　まず、これから。　小学１・２年生めやす　よみとき・なぞとき・ひらめき,,1076,19,0005,0001,0091,書籍,学習参考書,小学ドリル,小学ドリル,その他ドリル,ｉＭＬ国際算数・数学能力検定協会,0000300,ＴＡＣ出版事業部,43365197,自分のあたまで考えるドリル　まず、これから。　小学１・２年生めやす　よみとき・なぞとき・ひらめき,,20221027,1090,,
9784284001199,おまもりえほん　こどもぼうはんルールブック,,1076,16,0007,0001,0092,書籍,児童書,絵本,国内絵本,国内絵本,国崎信江,0000284,日本図書センター,43366741,おまもりえほん　こどもぼうはんルールブック,,20221019,2509,,
9784052056444,５分後に意外な結末ｅｘ　緑に覆われた世界の出来事,,1076,16,0041,0005,0022,書籍,児童書,読み物,読み物,５分後に意外な結末シリーズ,桃戸ハル,0000005,学研プラス,43363324,５分後に意外な結末ｅｘ　緑に覆われた世界の出来事,「５分後に意外な結末」シリーズ,20221215,3948,５分後に意外な結末,
9784092314467,小説映画ドラえもんのび太と空の理想郷,,1076,16,0055,0001,0019,書籍,児童書,児童文庫,児童文庫,小学館ジュニア文庫,藤子・Ｆ・不二雄,0000009,小学館,43398271,小説映画ドラえもんのび太と空の理想郷,小学館ジュニア文庫,20230203,2782,小学館ジュニア文庫,
9784774738642,メイクアップぬりえ　キュートポップコレクション,,1076,16,0015,0001,0041,書籍,児童書,しかけ絵本,しかけ絵本,ぬりえ,ｍｉｏ,0007747,コスミック出版,43380025,メイクアップぬりえ　キュートポップコレクション,［バラエティ］,20221128,3856,,
9784041125694,きょうりゅうかくれんぼ,,1076,16,0007,0004,0001,書籍,児童書,絵本,さがしもの絵本,さがしもの絵本,聞かせ屋。けいたろう,0000004,ＫＡＤＯＫＡＷＡ,43360531,きょうりゅうかくれんぼ,,20221004,8545,,
9784046321756,時間割男子　ヒミツにせまる動物園！,１０,1076,16,0055,0001,0015,書籍,児童書,児童文庫,児童文庫,角川つばさ文庫,一ノ瀬三葉,0000004,ＫＡＤＯＫＡＷＡ,43100036,時間割男子,角川つばさ文庫,20221214,7212,,
9784057508412,学研の科学　大図鑑プロジェクター　世界とつながるほんもの体験キット,,1076,16,0061,0001,0065,書籍,児童書,実用百科,実用百科,実験・自由研究,学研の科学編集部,0000005,学研プラス,43372767,学研の科学　大図鑑プロジェクター　世界とつながるほんもの体験キット,［バラエティ］,20221213,4731,,
9784099425203,タッチペンでいっぱいあそべる！まいにちのことばずかん１５００　英語つき,,1076,16,0011,0003,0001,書籍,児童書,幼児絵本,知育絵本,知育絵本,小学館辞典編集部,0000009,小学館,43377756,タッチペンでいっぱいあそべる！まいにちのことばずかん１５００　英語つき,［バラエティ］,20221205,3082,,
9784757568204,絵本　おじさまと猫　ふくまるとしあわせの宇宙船,,1076,16,0007,0001,0092,書籍,児童書,絵本,国内絵本,国内絵本,桜井海,0007575,スクウェア・エニックス,43175894,絵本　おじさまと猫　ふくまるとしあわせの宇宙船,,20221111,1858,,
9784801933798,マインクラフト３つの試練,,1076,16,0041,0005,0015,書籍,児童書,読み物,読み物,中学年読み物,スイー・デイヴィース,0008019,竹書房,43366428,マインクラフト３つの試練,,20221216,2528,,
9784813780724,この恋は、ぜったいヒミツ。,３,1076,16,0055,0001,0091,書籍,児童書,児童文庫,児童文庫,その他児童文庫,このはなさくら,0008137,スターツ出版,43205112,この恋は、ぜったいヒミツ。,野いちごジュニア文庫,20221118,1265,,
9784046321848,サバイバー！！　豪華客船は再会のとき,４,1076,16,0055,0001,0015,書籍,児童書,児童文庫,児童文庫,角川つばさ文庫,あさばみゆき,0000004,ＫＡＤＯＫＡＷＡ,43261596,サバイバー！！,角川つばさ文庫,20221109,2213,,
9784299036513,東大王からの挑戦！　めざせ子ども東大王　最強クイズ,,1076,16,0061,0001,0011,書籍,児童書,実用百科,実用百科,クイズ・なぞなぞ,ＴＢＳテレビ「東大王」クイズ制作チーム,0000299,宝島社,43385234,東大王からの挑戦！　めざせ子ども東大王　最強クイズ,,20221212,1570,,
9784046321930,神スキル！！！　キセキの三きょうだい、登場！,,1076,16,0055,0001,0015,書籍,児童書,児童文庫,児童文庫,角川つばさ文庫,大空なつき,0000004,ＫＡＤＯＫＡＷＡ,43383100,神スキル！！！　キセキの三きょうだい、登場！,角川つばさ文庫,20230112,2091,,
9784591175682,かいけつゾロリ　きょうりゅうママをすくえ！,,1076,16,0041,0005,0011,書籍,児童書,読み物,読み物,かいけつゾロリシリーズ,原ゆたか,0000591,ポプラ社,43379327,かいけつゾロリ　きょうりゅうママをすくえ！,かいけつゾロリシリーズ,20221207,11508,ポプラ社の新・小さな童話,
9784866515670,いますぐ名探偵　犯人をさがせ！　ワハハ小学校編,,1076,16,0015,0001,0021,書籍,児童書,しかけ絵本,しかけ絵本,しかけ絵本,桂林ブックス,0086651,文響社,43374615,いますぐ名探偵　犯人をさがせ！　ワハハ小学校編,,20221208,1410,,
9784813780694,願いごとガチャ　願いをかなえるアイテム当たります,,1076,16,0055,0001,0091,書籍,児童書,児童文庫,児童文庫,その他児童文庫,Ｓｙｔｒｙ,0008137,スターツ出版,43365498,願いごとガチャ　願いをかなえるアイテム当たります,野いちごジュニア文庫,20221020,1350,,
9784791631902,ミラクルきょうふ！　意味がわかると怖いストーリー,,1076,16,0041,0005,0041,書籍,児童書,読み物,読み物,おばけ・こわい話,朔月糸,0007916,西東社,43369786,ミラクルきょうふ！　意味がわかると怖いストーリー,,20221107,3067,,
9784791632008,ゆめがひろがるおんなのこのでんきえほん　全２２話,,1076,16,0007,0001,0021,書籍,児童書,絵本,国内絵本,国内の名作絵本,堀米薫,0007916,西東社,43374714,ゆめがひろがるおんなのこのでんきえほん　全２２話,,20221107,2037,,
9784046321732,本当はこわい話　明かされる真実、君は気づけた？,１０,1076,16,0055,0001,0015,書籍,児童書,児童文庫,児童文庫,角川つばさ文庫,小林丸々,0000004,ＫＡＤＯＫＡＷＡ,42960710,本当はこわい話,角川つばさ文庫,20230112,1206,,
9784046321923,世界一クラブ　スター・ダイヤを取りもどせ！,,1076,16,0055,0001,0015,書籍,児童書,児童文庫,児童文庫,角川つばさ文庫,大空なつき,0000004,ＫＡＤＯＫＡＷＡ,43377084,世界一クラブ　スター・ダイヤを取りもどせ！,角川つばさ文庫,20221214,2973,,
9784083217548,花とつぼみと、きみのこと。　だいじな想いの咲かせかた,,1076,16,0055,0001,0018,書籍,児童書,児童文庫,児童文庫,集英社みらい文庫,五十嵐美怜,0000008,集英社,43382705,花とつぼみと、きみのこと。　だいじな想いの咲かせかた,集英社みらい文庫,20221216,1346,,
9784591175262,グレッグのダメ日記　なんだって、やってやる！,,1076,16,0041,0005,0017,書籍,児童書,読み物,読み物,グレッグのダメ日記シリーズ,ジェフ・キニー,0000591,ポプラ社,43377481,グレッグのダメ日記　なんだって、やってやる！,,20221124,2872,単行本,
9784651202686,歴史バトル図鑑　最強！戦国武将決定戦,,1076,16,0071,0001,0047,書籍,児童書,学習百科,学習百科,歴史（読みもの）,小和田哲男,0000651,ＯＮＥ　ＰＵＢＬＩＳＨＩＮＧ,43372104,歴史バトル図鑑　最強！戦国武将決定戦,,20221117,1652,,
9784813780779,溺愛×ミッション！（１）　エリート学園の超モテスパイ男子たちに溺愛されちゃってます！,１,1076,16,0055,0001,0091,書籍,児童書,児童文庫,児童文庫,その他児童文庫,青山そらら,0008137,スターツ出版,43379193,溺愛×ミッション！（１）　エリート学園の超モテスパイ男子たちに溺愛されちゃってます！,野いちごジュニア文庫,20221220,1381,,
9784813780687,告白したのは、君だから。　かんちがいから始まるホントの恋,,1076,16,0055,0001,0091,書籍,児童書,児童文庫,児童文庫,その他児童文庫,神戸遥真,0008137,スターツ出版,43365497,告白したのは、君だから。　かんちがいから始まるホントの恋,野いちごジュニア文庫,20221020,1603,,
9784756253842,きみも運転手になれる！　パノラマずかん　運転席,,1076,16,0015,0001,0021,書籍,児童書,しかけ絵本,しかけ絵本,しかけ絵本,宮本えつよし,0007562,パイインターナショナル,43365386,きみも運転手になれる！　パノラマずかん　運転席,,20221124,1077,,
9784813780700,ウタイテ！,３,1076,16,0055,0001,0091,書籍,児童書,児童文庫,児童文庫,その他児童文庫,＊あいら＊,0008137,スターツ出版,43313006,ウタイテ！,野いちごジュニア文庫,20221118,6086,ウタイテ！,
9784083217463,相方なんかになりません！　転校生はなにわのお笑い男子！？,,1076,16,0055,0001,0018,書籍,児童書,児童文庫,児童文庫,集英社みらい文庫,遠山彼方,0000008,集英社,43366737,相方なんかになりません！　転校生はなにわのお笑い男子！？,集英社みらい文庫,20221028,1264,,
9784041130254,どっちが強い！？　動物ｖｓ恐竜　夢の超時空バトル,,1076,16,0071,0005,0031,書籍,児童書,学習百科,学習漫画,どっちが強い！？シリーズ,Ｘベンチャーオールスターズ,0000004,ＫＡＤＯＫＡＷＡ,43387253,どっちが強い！？　動物ｖｓ恐竜　夢の超時空バトル,角川まんが学習シリーズ,20230215,2805,,
9784052055935,ふたごのプリンセスとピアニストのひみつクレープ,,1076,16,0041,0005,0005,書籍,児童書,読み物,読み物,低学年読み物,赤尾でこ,0000005,学研プラス,43369057,ふたごのプリンセスとピアニストのひみつクレープ,まほうのドレスハウス,20221129,2580,まほうのドレスハウス,
9784023322219,科学探偵ｖｓ．超・自然現象（前）,,1076,16,0041,0005,0021,書籍,児童書,読み物,読み物,高学年読み物,佐東みどり,0000002,朝日新聞出版,43376612,科学探偵ｖｓ．超・自然現象,科学探偵謎野真実シリーズ,20221118,2201,科学探偵　謎野真実シリーズ,
9784074535231,ＢＴ２１　まちがいをさがせ！,,1076,16,0007,0004,0001,書籍,児童書,絵本,さがしもの絵本,さがしもの絵本,ＬＩＮＥＦｒｉｅｎｄｓＪａｐａｎ,0000007,主婦の友社,43384708,ＢＴ２１　まちがいをさがせ！,,20221212,1625,,
9784097353508,めくってあそぼう！しかけえほん　シナぷしゅ,,1076,16,0021,0001,0051,書籍,児童書,キャラクター絵本,キャラクター絵本,その他キャラクター,ｍｉｏ,0000009,小学館,43379300,めくってあそぼう！しかけえほん　シナぷしゅ,,20221121,1471,,
