JAN,SHOSINM,KANSU,ITMCD,DAIGENRECD,CHUGENRECD,SHOGENRECD,SIKIRIBANCD,ITMNM,DAIGENRENM,CHUGENRENM,SHOGENRENM,SIKIRIBANNM,CHOSHANM,SHPNSHACD,SHPNSHANM,SAKUHINCD,SAKUHINNM,SOSHONM,HATUBAIYMD,ANNUAL_SALES,SUBLABEL,SERIESNM
9784023322226,徳川家康へタイムワープ　？！歴史漫画タイムワープシリーズ,,1076,16,0071,0005,0091,書籍,児童書,学習百科,学習漫画,その他学習漫画,ＴＡＫ．Ｂｒｏ,0000002,朝日新聞出版,43376613,徳川家康へタイムワープ　？！歴史漫画タイムワープシリーズ,歴史人物ＢＯＯＫ,20221118,1515,歴史漫画タイムワープシリーズ,歴史漫画タイムワープシリーズ
9784023322141,トンネルのサバイバル,,1076,16,0071,0005,0021,書籍,児童書,学習百科,学習漫画,サバイバルシリーズ,パク・ソンイ,0000002,朝日新聞出版,43366736,トンネルのサバイバル,かがくるＢＯＯＫ　科学漫画サバイバルシリーズ　８０,20221007,17125,科学漫画サバイバルシリーズ８０,サバイバルシリーズ
9784023322158,テーマパークのサバイバル,,1076,16,0071,0005,0021,書籍,児童書,学習百科,学習漫画,サバイバルシリーズ,ポドアルチング,0000002,朝日新聞出版,43380283,テーマパークのサバイバル,かがくるＢＯＯＫ　科学漫画サバイバルシリーズ　８１,20221207,23076,科学漫画サバイバルシリーズ８１,サバイバルシリーズ
9784023333772,きらきら　ぴかぴか,,1076,16,0011,0002,0001,書籍,児童書,幼児絵本,ファーストブック,ファーストブック,瀧靖之,0000002,朝日新聞出版,43369774,きらきら　ぴかぴか,脳科学にもとづいた知育絵本,20221020,7306,脳科学にもとづいた知育絵本,脳科学にもとづいた知育絵本
9784023322080,実験対決　火山の対決　学校勝ちぬき戦　実験対決シリーズ　明日は実験王,４３,1076,16,0071,0005,0021,書籍,児童書,学習百科,学習漫画,サバイバルシリーズ,ストーリーａ．,0000002,朝日新聞出版,42202145,実験対決,かがくるＢＯＯＫ,20221118,1000,,サバイバルシリーズ
9784031271905,すうじのかくれんぼ,,1076,16,0015,0001,0021,書籍,児童書,しかけ絵本,しかけ絵本,しかけ絵本,いしかわこうじ,0000003,偕成社,43370935,すうじのかくれんぼ,あっ！とおどろくしかけえほん,20221205,1172,,あっ！とおどろくしかけえほん
9784041126547,どっちが強い！？Ａ　ロボットで入学試験！？,１,1076,16,0071,0005,0031,書籍,児童書,学習百科,学習漫画,どっちが強い！？シリーズ,スライウム,0000004,ＫＡＤＯＫＡＷＡ,43369333,どっちが強い！？Ａ,,20221116,3519,,どっちが強い！？シリーズ
9784041127742,どっちが強い！？ガチンコ動物オリンピック編　なんでもＮｏ．１決定戦,,1076,16,0071,0005,0031,書籍,児童書,学習百科,学習漫画,どっちが強い！？シリーズ,ブラックインクチーム,0000004,ＫＡＤＯＫＡＷＡ,43369402,どっちが強い！？ガチンコ動物オリンピック編　なんでもＮｏ．１決定戦,角川まんが学習シリーズ,20221130,9083,,どっちが強い！？シリーズ
9784041122914,どっちが強い！？　ピットブルｖｓオオヤマネコ　豪華客船でイヌネコ対決,,1076,16,0071,0005,0031,書籍,児童書,学習百科,学習漫画,どっちが強い！？シリーズ,ジノ,0000004,ＫＡＤＯＫＡＷＡ,43377192,どっちが強い！？　ピットブルｖｓオオヤマネコ　豪華客船でイヌネコ対決,角川まんが学習シリーズ,20221214,9239,,どっちが強い！？シリーズ
9784041126554,どっちが強い！？Ａ　無人島でロボバトル！,２,1076,16,0071,0005,0031,書籍,児童書,学習百科,学習漫画,どっちが強い！？シリーズ,レッドコード,0000004,ＫＡＤＯＫＡＷＡ,43369333,どっちが強い！？Ａ,,20221116,2906,,どっちが強い！？シリーズ
9784049146707,すみっコぐらしいっしょにクロスワード,,1076,16,0021,0001,0051,書籍,児童書,キャラクター絵本,キャラクター絵本,その他キャラクター,キャラぱふぇ編集部,0000004,ＫＡＤＯＫＡＷＡ,43372072,すみっコぐらしいっしょにクロスワード,キャラぱふぇブックス,20221130,1755,,すみっコぐらし
9784052055966,正解のない問題集　道徳編,,1076,16,0071,0001,0007,書籍,児童書,学習百科,学習百科,道徳・教養,池上彰,0000005,学研プラス,43369058,正解のない問題集　道徳編,新時代の教養,20221117,3281,新時代の教養,新時代の教養
9784052055881,こどもずかん　のりもの７７７　英語つき　しゃしんバージョン,,1076,16,0011,0003,0001,書籍,児童書,幼児絵本,知育絵本,知育絵本,デイブ・テルキ,0000005,学研プラス,43369056,こどもずかん　のりもの７７７　英語つき　しゃしんバージョン,こどもずかん,20221125,5125,こどもずかん,こどもずかん
9784052056383,めくってばあ！,,1076,16,0011,0002,0001,書籍,児童書,幼児絵本,ファーストブック,ファーストブック,いりやまさとし,0000005,学研プラス,43369406,めくってばあ！,ＮＥＷぴよちゃんとあそぼ！,20221104,2288,ＮＥＷぴよちゃんとあそぼ！,ＮＥＷぴよちゃんとあそぼ！
9784052056727,最強王キャラ図鑑,,1076,16,0061,0001,0091,書籍,児童書,実用百科,実用百科,その他実用百科,国際最強王図鑑協会,0000005,学研プラス,43375608,最強王キャラ図鑑,最強王図鑑シリーズ,20221222,18450,最強王図鑑シリーズ,最強王図鑑シリーズ
9784052056000,０さい〜３さい脳そだて　おさかなちゃんとあ〜そ〜ぼ！,,1076,16,0011,0002,0001,書籍,児童書,幼児絵本,ファーストブック,ファーストブック,茂木健一郎,0000005,学研プラス,43360343,０さい～３さい脳そだて　おさかなちゃんとあ～そ～ぼ！,,20221020,1083,おさかなちゃん,おさかなちゃん
9784046321954,四つ子ぐらし　プレゼントに思いをこめて,１３,1076,16,0055,0001,0015,書籍,児童書,児童文庫,児童文庫,角川つばさ文庫,ひのひまり,0000004,ＫＡＤＯＫＡＷＡ,43007684,四つ子ぐらし,角川つばさ文庫,20221109,19208,,四つ子ぐらし
9784052055171,きょうりゅう,,1076,16,0081,0001,0011,書籍,児童書,図鑑,図鑑,学習図鑑シリーズ,真鍋真,0000005,学研プラス,43369054,きょうりゅう,ひとりでよめるずかん,20221118,1179,ひとりでよめるずかん,ひとりでよめるずかん
9784065301944,トミカライトペンでしらべろ！トミカのひみつだいずかん,,1076,16,0035,0001,0011,書籍,児童書,絵本塔,絵本塔,講談社,講談社,0000006,講談社,43372075,トミカライトペンでしらべろ！トミカのひみつだいずかん,講談社ＭＯＯＫ,20221212,1751,,講談社ＭＯＯＫ
9784053049247,マンガでわかる中学英語中１〜３,,1076,19,0021,0005,0001,書籍,学習参考書,中学学参,基礎学習,基礎学習参考書,竹屋まり子,0000005,学研プラス,43222649,マンガでわかる中学英語中１～３,ＣＯＭＩＣ×ＳＴＵＤＹ,20221006,2553,ＣＯＭＩＣ×ＳＴＵＤＹ,ＣＯＭＩＣ×ＳＴＵＤＹ
9784065264461,日本の歴史,,1076,16,0081,0001,0011,書籍,児童書,図鑑,図鑑,学習図鑑シリーズ,西谷大,0000006,講談社,43358029,日本の歴史,講談社の動く図鑑ＭＯＶＥ,20221129,4178,,講談社の動く図鑑ＭＯＶＥ
9784065290361,仮面ライダーギーツもじかずちえドリル,,1076,19,0001,0001,0001,書籍,学習参考書,幼児ドリル,幼児ドリル,幼児ドリル,講談社,0000006,講談社,43357398,仮面ライダーギーツもじかずちえドリル,キャラクタードリルシリーズ,20221018,1335,,キャラクタードリルシリーズ
9784074523115,いきもののふしぎはっけん！３６６クイズ,,1076,16,0071,0001,0407,書籍,児童書,学習百科,学習百科,理科　動物,主婦の友社,0000007,主婦の友社,43377197,いきもののふしぎはっけん！３６６クイズ,頭のいい子を育てる,20221117,1404,頭のいい子を育てる,頭のいい子を育てる
9784053056016,高校入試出るナビ英語,,1076,19,0021,0061,0001,書籍,学習参考書,中学学参,高校入試,入試対策問題集,ｍｉｏ,0000005,学研プラス,43360363,高校入試出るナビ英語,高校入試出るナビ,20221006,1237,高校入試　出るナビ,高校入試出るナビ
9784065300985,あつまれ！　トミカ　いっぱいずかん,,1076,16,0035,0001,0011,書籍,児童書,絵本塔,絵本塔,講談社,ｍｉｏ,0000006,講談社,43384012,あつまれ！　トミカ　いっぱいずかん,講談社ＭＯＯＫ,20221208,2372,,講談社ＭＯＯＫ
9784053056047,高校入試出るナビ理科,,1076,19,0021,0061,0001,書籍,学習参考書,中学学参,高校入試,入試対策問題集,ｍｉｏ,0000005,学研プラス,43360366,高校入試出るナビ理科,高校入試出るナビ,20221006,1301,高校入試　出るナビ,高校入試出るナビ
9784053056054,高校入試出るナビ社会,,1076,19,0021,0061,0001,書籍,学習参考書,中学学参,高校入試,入試対策問題集,ｍｉｏ,0000005,学研プラス,43360367,高校入試出るナビ社会,高校入試出るナビ,20221006,1789,高校入試　出るナビ,高校入試出るナビ
9784065293355,アナと雪の女王　アナ雪　きらきら　えほん文庫,,1076,16,0021,0001,0005,書籍,児童書,キャラクター絵本,キャラクター絵本,ディズニー,講談社,0000006,講談社,43362343,アナと雪の女王　アナ雪　きらきら　えほん文庫,ディズニーえほん文庫,20221027,1019,,ディズニーえほん文庫
9784074525584,ジブリの食卓となりのトトロ,,1076,16,0061,0001,0041,書籍,児童書,実用百科,実用百科,料理,スタジオジブリ,0000007,主婦の友社,43364239,ジブリの食卓となりのトトロ,子どもりょうり絵本,20221004,1019,,子どもりょうり絵本
9784091125972,それいけ！アンパンマン　シールいっぱい！　たべものこれなあにブック,,1076,16,0035,0001,0001,書籍,児童書,絵本塔,絵本塔,小学館,やなせたかし,0000009,小学館,43377198,それいけ！アンパンマン　シールいっぱい！　たべものこれなあにブック,小学館のカラーワイド,20221124,1741,カラーワイド,アンパンマン_小学館のカラーワイド
9784065300992,全ウルトラマン　パーフェクト大図鑑　増補改訂,,1076,16,0035,0001,0011,書籍,児童書,絵本塔,絵本塔,講談社,講談社,0000006,講談社,43385230,全ウルトラマン　パーフェクト大図鑑　増補改訂,講談社ＭＯＯＫ　テレビマガジンＭＯＯＫ,20221215,2232,,講談社ＭＯＯＫ　テレビマガジンＭＯＯＫ
9784065294994,はってはがせる！仮面ライダーギーツ超シールバトルロイヤル！,,1076,16,0035,0001,0011,書籍,児童書,絵本塔,絵本塔,講談社,講談社,0000006,講談社,43357380,はってはがせる！仮面ライダーギーツ超シールバトルロイヤル！,講談社ＭＯＯＫ　テレビマガジンＭＯＯＫ,20221024,1763,,講談社ＭＯＯＫ　テレビマガジンＭＯＯＫ
9784065301197,ウルトラライトペンでちょうさせよ！ウルトラヒーロー＆かいじゅうひみつバトルだいず,,1076,16,0035,0001,0011,書籍,児童書,絵本塔,絵本塔,講談社,講談社,0000006,講談社,43372550,ウルトラライトペンでちょうさせよ！ウルトラヒーロー＆かいじゅうひみつバトルだいず,おと幼ムック,20221212,2198,,おと幼ムック
9784053056061,高校入試出るナビ５科　改訂版,,1076,19,0021,0061,0001,書籍,学習参考書,中学学参,高校入試,入試対策問題集,学研プラス,0000005,学研プラス,43360368,高校入試出るナビ５科　改訂版,高校入試出るナビ,20221027,4077,高校入試　出るナビ,高校入試出るナビ
9784057508320,キャンディねんどでつくる　つやぷるアクセサリー,,1076,16,0061,0001,0043,書籍,児童書,実用百科,実用百科,おしゃれ,ｓａｒｉｃｏ,0000005,学研プラス,43369072,キャンディねんどでつくる　つやぷるアクセサリー,［バラエティ］　ガールズクラフト,20221115,1838,ガールズクラフト,ガールズクラフト
9784065304358,全仮面ライダー　パーフェクト大図鑑　増補改訂,,1076,16,0035,0001,0011,書籍,児童書,絵本塔,絵本塔,講談社,ｍｉｏ,0000006,講談社,43374260,全仮面ライダー　パーフェクト大図鑑　増補改訂,講談社ＭＯＯＫ　テレビマガジンデラックス　２５２,20221223,1363,,講談社ＭＯＯＫ　テレビマガジンデラックス　２５２
9784065291702,仮面ライダーギーツとあそぼう！,,1076,16,0035,0001,0011,書籍,児童書,絵本塔,絵本塔,講談社,講談社,0000006,講談社,43372549,仮面ライダーギーツとあそぼう！,,20221025,10296,,仮面ライダー
9784065301036,仮面ライダーギーツとあそぼう！　レジェンド,,1076,16,0035,0001,0011,書籍,児童書,絵本塔,絵本塔,講談社,講談社,0000006,講談社,43379298,仮面ライダーギーツとあそぼう！　レジェンド,講談社ＭＯＯＫ　テレビマガジンＭＯＯＫ,20221215,6903,,講談社ＭＯＯＫ　テレビマガジンＭＯＯＫ
9784091066275,ピカチュウとあそぼ！　ピカチュウのだいぼうけん　ポケモンおはなし＆おあそびブック,,1076,16,0035,0001,0001,書籍,児童書,絵本塔,絵本塔,小学館,よしのえみこ,0000009,小学館,43372077,ピカチュウとあそぼ！　ピカチュウのだいぼうけん　ポケモンおはなし＆おあそびブック,ワンダーライフスペシャル,20221024,1568,ワンダーライフスペシャル,ワンダーライフスペシャル
9784092175143,乗りもの　新版　鉄道・自動車・飛行機・船,,1076,16,0081,0001,0011,書籍,児童書,図鑑,図鑑,学習図鑑シリーズ,長根広和,0000009,小学館,43374262,乗りもの　新版　鉄道・自動車・飛行機・船,小学館の図鑑ＮＥＯ,20221129,9960,小学館の図鑑NEO,小学館の図鑑ＮＥＯ
9784097251743,チャレンジミッケ！　ポケット版　サンタクロース,４,1076,16,0007,0004,0031,書籍,児童書,絵本,さがしもの絵本,ミッケ,ウォルター・ウィック,0000009,小学館,43341242,チャレンジミッケ！　ポケット版,,20221129,1065,,ミッケ
9784097355984,星のカービィ　ディスカバリー　ほおばれ！シールブック,,1076,16,0021,0001,0051,書籍,児童書,キャラクター絵本,キャラクター絵本,その他キャラクター,ワープスター,0000009,小学館,43372078,星のカービィ　ディスカバリー　ほおばれ！シールブック,まるごとシールブックＤＸ,20221026,2574,まるごとシールブック,まるごとシールブックＤＸ
9784092592094,ドラえもん探究ワールド　本の歴史と未来,,1076,16,0071,0001,0021,書籍,児童書,学習百科,学習百科,ドラえもんの学習シリ－ズ,藤子・Ｆ・不二雄,0000009,小学館,43370509,ドラえもん探究ワールド　本の歴史と未来,ビッグ・コロタン,20221116,3018,ビッグ･コロタン,ビッグコロタン
9784092536418,マインクラフト　公式ドリル　さんすう　ステップ２　７ー８才におすすめ　マイクラで楽しく理数系センスを身につける！,,1076,19,0005,0001,0091,書籍,学習参考書,小学ドリル,小学ドリル,その他ドリル,夏坂哲志,0000009,小学館,43368533,マインクラフト　公式ドリル　さんすう　ステップ２　７ー８才におすすめ　マイクラで楽しく理数系センスを身につける！,知育ドリル,20221013,3870,知育ドリル,知育ドリル
9784092592117,ドラえもん探究ワールド　ねむりと夢のふしぎ,,1076,16,0071,0001,0021,書籍,児童書,学習百科,学習百科,ドラえもんの学習シリ－ズ,藤子・Ｆ・不二雄,0000009,小学館,43383706,ドラえもん探究ワールド　ねむりと夢のふしぎ,ビッグ・コロタン,20221207,4395,ビッグ･コロタン,ビッグコロタン
9784198655471,スタジオジブリのヒロインがいっぱい,,1076,16,0021,0001,0035,書籍,児童書,キャラクター絵本,キャラクター絵本,ジブリ,スタジオジブリ,0000019,徳間書店,43359658,スタジオジブリのヒロインがいっぱい,徳間アニメ絵本ミニ,20221015,1194,,ジブリ
9784097353492,ワンワンの　パンやさん,,1076,16,0021,0001,0051,書籍,児童書,キャラクター絵本,キャラクター絵本,その他キャラクター,ＮＨＫエデュケーショナル,0000009,小学館,43380286,ワンワンの　パンやさん,ゆびにんぎょうえほん　いないいないばあっ！,20221207,1778,,ゆびにんぎょうえほん　いないいないばあっ！
9784092592100,ドラえもん科学ワールドｓｐｅｃｉａｌ　みんなのためのデジタル入門,,1076,16,0071,0001,0021,書籍,児童書,学習百科,学習百科,ドラえもんの学習シリ－ズ,藤子・Ｆ・不二雄,0000009,小学館,43363325,ドラえもん科学ワールドｓｐｅｃｉａｌ　みんなのためのデジタル入門,ビッグ・コロタン,20221116,6128,ビッグ･コロタン,ビッグコロタン
9784097251897,ピタゴラじゃんけん装置ＱＲブック　ピタの巻,,1076,16,0061,0001,0061,書籍,児童書,実用百科,実用百科,工作,ＮＨＫエデュケーショナル,0000009,小学館,43374263,ピタゴラじゃんけん装置ＱＲブック　ピタの巻,ピタゴラＢＯＯＫ,20221026,3049,,ピタゴラＢＯＯＫ
9784097353485,ぷしゅぷしゅの　こんにちは！,,1076,16,0021,0001,0051,書籍,児童書,キャラクター絵本,キャラクター絵本,その他キャラクター,テレビ東京,0000009,小学館,43380285,ぷしゅぷしゅの　こんにちは！,ゆびにんぎょうえほん　シナぷしゅ,20221207,2586,,シナぷしゅ
9784092989313,小学館版学習まんが日本の歴史（全２０巻セット）,,1076,16,0071,0005,0001,書籍,児童書,学習百科,学習漫画,日本の歴史,小学館,0000009,小学館,43351790,小学館版学習まんが日本の歴史（全２０巻セット）,小学館学習まんがシリーズ,20221201,2211,小学館 学習まんがシリーズ,小学館学習まんがシリーズ
9784097504368,てれびくん超ひゃっかシリーズ　ウルトラマンデッカー　デッカー＆ヒーローバトルずかん,,1076,16,0021,0001,0041,書籍,児童書,キャラクター絵本,キャラクター絵本,ヒーロー,間宮尚彦,0000009,小学館,43378663,てれびくん超ひゃっかシリーズ　ウルトラマンデッカー　デッカー＆ヒーローバトルずかん,超ひゃっか,20221116,1405,超ひゃっか,超ひゃっか
9784092536425,マインクラフト　公式ドリル　さんすう　ステップ１　６ー７才におすすめ　マイクラで楽しく理数系センスを身につける！,,1076,19,0005,0001,0091,書籍,学習参考書,小学ドリル,小学ドリル,その他ドリル,夏坂哲志,0000009,小学館,43368534,マインクラフト　公式ドリル　さんすう　ステップ１　６ー７才におすすめ　マイクラで楽しく理数系センスを身につける！,知育ドリル,20221013,5279,知育ドリル,知育ドリル
9784092984011,日本の歴史　日本文化のあけぼの　旧石器〜縄文〜弥生〜古墳時代,１,1076,16,0071,0005,0001,書籍,児童書,学習百科,学習漫画,日本の歴史,山川出版社,0000009,小学館,43381698,小学館版学習まんが　日本の歴史,小学館学習まんがシリーズ,20221201,1176,小学館 学習まんがシリーズ,小学館学習まんがシリーズ
9784097251903,ピタゴラじゃんけん装置ＱＲブック　ゴラの巻,,1076,16,0061,0001,0061,書籍,児童書,実用百科,実用百科,工作,ＮＨＫエデュケーショナル,0000009,小学館,43374264,ピタゴラじゃんけん装置ＱＲブック　ゴラの巻,ピタゴラＢＯＯＫ,20221026,2157,,ピタゴラＢＯＯＫ
9784494003808,みかんくんがね・・,,1076,16,0011,0003,0005,書籍,児童書,幼児絵本,知育絵本,たべもの絵本,とよたかずひこ,0000494,童心社,43365481,みかんくんがね・・,おいしいともだち,20221014,1511,おいしいともだち,おいしいともだち
9784415332161,のりものずかん,,1076,16,0011,0003,0001,書籍,児童書,幼児絵本,知育絵本,知育絵本,成美堂出版編集部,0000415,成美堂出版,43378668,のりものずかん,じぶんでよめる,20221110,2524,,じぶんでよめる
9784522439999,１０才からの勉強が得意になる方法,,1076,16,0071,0001,0008,書籍,児童書,学習百科,学習百科,その他教科,葉一,0000522,永岡書店,43365870,１０才からの勉強が得意になる方法,大人だって本当は知らない,20221011,1196,,大人だって本当は知らない
9784325253600,福岡大学（医学部医学科を除くー一般選抜前期日程）２０２３,,1076,19,0031,0061,0011,書籍,学習参考書,高校学参,大学受験,大学別赤本,教学社編集部,0000325,教学社,43371510,福岡大学（医学部医学科を除くー一般選抜前期日程）２０２３,大学入試シリーズ,20221012,1201,2023年版大学入試シリーズ,大学入試シリーズ
9784325251255,東海大学（医学部医学科を除くー一般選抜）　２０２３,,1076,19,0031,0061,0011,書籍,学習参考書,高校学参,大学受験,大学別赤本,教学社編集部,0000325,教学社,43367832,東海大学（医学部医学科を除くー一般選抜）　２０２３,大学入試シリーズ,20221006,1023,2023年版大学入試シリーズ,大学入試シリーズ
9784415332178,でんしゃずかん,,1076,16,0011,0003,0001,書籍,児童書,幼児絵本,知育絵本,知育絵本,成美堂出版編集部,0000415,成美堂出版,43378669,でんしゃずかん,じぶんでよめる,20221110,2424,,じぶんでよめる
9784325251002,専修大学（学部個別入試）　２０２３,,1076,19,0031,0061,0011,書籍,学習参考書,高校学参,大学受験,大学別赤本,教学社編集部,0000325,教学社,43367829,専修大学（学部個別入試）　２０２３,大学入試シリーズ,20221006,1656,2023年版大学入試シリーズ,大学入試シリーズ
9784522803134,ごはんもぐもぐいただきま〜す！　とびだすえほん,,1076,16,0015,0001,0021,書籍,児童書,しかけ絵本,しかけ絵本,しかけ絵本,さくらいひろし,0000522,永岡書店,43365871,ごはんもぐもぐいただきま～す！　とびだすえほん,,20221011,1505,,とびだすえほん
9784591174951,ディズニープリンセスのひみつ１００,,1076,16,0021,0001,0005,書籍,児童書,キャラクター絵本,キャラクター絵本,ディズニー,ｍｉｏ,0000591,ポプラ社,43367769,ディズニープリンセスのひみつ１００,,20221013,1947,単行本,ディズニー
9784591175194,あおい１ばんのきかんしゃ　トーマスどーこだ？,,1076,16,0021,0001,0011,書籍,児童書,キャラクター絵本,キャラクター絵本,トーマス,ｍｉｏ,0000591,ポプラ社,43374278,あおい１ばんのきかんしゃ　トーマスどーこだ？,きかんしゃトーマスの本,20221109,1182,きかんしゃトーマスの本,きかんしゃトーマスの本
9784591175644,きかんしゃトーマス　キャラクターずかん,,1076,16,0021,0001,0055,書籍,児童書,キャラクター絵本,キャラクター絵本,超ひみつゲット,ｍｉｏ,0000591,ポプラ社,43380017,きかんしゃトーマス　キャラクターずかん,超ひみつゲット！,20221207,3227,超ひみつゲット！,超ひみつゲット
9784577051191,アンパンマンおままごとえほん　おべんとう,,1076,16,0021,0001,0001,書籍,児童書,キャラクター絵本,キャラクター絵本,アンパンマン,やなせたかし,0000577,フレーベル館,43379325,アンパンマンおままごとえほん　おべんとう,,20221216,1462,アンパンマンおままごとえほん,アンパンマンおままごとえほん
9784592763161,ノラネコぐんだん　うみのたび,,1076,16,0007,0001,0201,書籍,児童書,絵本,国内絵本,ノラネコぐんだん,工藤ノリコ,0000592,白泉社,43368308,ノラネコぐんだん　うみのたび,コドモエのえほん,20221104,26177,,ノラネコぐんだん
9784593103782,クリスマスプレゼントなぁに？,,1076,16,0011,0002,0001,書籍,児童書,幼児絵本,ファーストブック,ファーストブック,フフフーン,0000593,ほるぷ出版,43357128,クリスマスプレゼントなぁに？,めくって　たのしい　しかけえほん,20221011,1726,めくって たのしい しかけえほん,めくって　たのしい　しかけえほん
9784577050705,ＰＵＩ　ＰＵＩ　モルカー　を　さがせ！,,1076,16,0021,0001,0051,書籍,児童書,キャラクター絵本,キャラクター絵本,その他キャラクター,フレーベル館,0000577,フレーベル館,43370954,ＰＵＩ　ＰＵＩ　モルカー　を　さがせ！,,20221124,2114,PUI PUI モルカー,ＰＵＩ　ＰＵＩ　モルカー
