JAN,SHOSINM,KANSU,ITMCD,DAIGENRECD,CHUGENRECD,SHOGENRECD,SIKIRIBANCD,ITMNM,DAIGENRENM,CHUGENRENM,SHOGENRENM,SIKIRIBANNM,CHOSHANM,SHPNSHACD,SHPNSHANM,SAKUHINCD,SAKUHINNM,SOSHONM,HATUBAIYMD,ANNUAL_SALES,SUBLABEL,SERIESNM
9784522803493,最恐！　危険生物かるた　超危険な生物のなまえで　ひらがなとカタカナをおぼえよう！,,1076,16,0091,0001,0005,書籍,児童書,グッズ,グッズ,かるた,岩崎政志,0000522,永岡書店,43373845,最恐！　危険生物かるた　超危険な生物のなまえで　ひらがなとカタカナをおぼえよう！,,20221110,1066,,
9784065307458,ちいリベ　クリアファイルブック,,1076,16,0091,0001,0092,書籍,児童書,グッズ,グッズ,キャラクターグッズ,講談社,0000006,講談社,43379651,ちいリベ　クリアファイルブック,［バラエティ］,20230131,1066,,
9784265809660,妖怪捕物帖乙　冥界彷徨篇　無間地獄は阿鼻の闇４,,1076,16,0041,0005,0005,書籍,児童書,読み物,読み物,低学年読み物,大崎悌造,0000265,岩崎書店,43363706,妖怪捕物帖乙　冥界彷徨篇　無間地獄は阿鼻の闇４,ようかいとりものちょう,20221018,2767,ようかいとりものちょう,
9784471104078,うちゅう,,1076,16,0081,0001,0011,書籍,児童書,図鑑,図鑑,学習図鑑シリーズ,山岡均,0000471,高橋書店,43370519,うちゅう,はじめてのずかん,20221129,1984,,
9784046321787,絶体絶命ゲーム　ねらわれた歌姫を守れ！,１２,1076,16,0055,0001,0015,書籍,児童書,児童文庫,児童文庫,角川つばさ文庫,藤ダリオ,0000004,ＫＡＤＯＫＡＷＡ,42843882,絶体絶命ゲーム,角川つばさ文庫,20221109,6033,,
9784049145472,星のカービィ　プププナゾトレブック,,1076,16,0021,0001,0051,書籍,児童書,キャラクター絵本,キャラクター絵本,その他キャラクター,ワープスター,0000004,ＫＡＤＯＫＡＷＡ,43375600,星のカービィ　プププナゾトレブック,,20221214,1136,,
9784052056154,マンガ・クイズつき『桃太郎電鉄』で学ぶお金・経済のしくみ攻略,,1076,16,0071,0001,0005,書籍,児童書,学習百科,学習百科,社会,正頭英和,0000005,学研プラス,43375602,マンガ・クイズつき『桃太郎電鉄』で学ぶお金・経済のしくみ攻略,,20221215,2305,,
9784774622781,ポコポコクリスマスクッキー,,1076,16,0007,0001,0092,書籍,児童書,絵本,国内絵本,国内絵本,さかいさちえ,0007746,教育画劇,43372775,ポコポコクリスマスクッキー,,20221115,4602,ちいさなちいさなポコポコえほん,
9784591175149,おしりたんてい　ププッ　かいていいせきのぼうけん　アニメコミック,１３,1076,16,0041,0005,0007,書籍,児童書,読み物,読み物,おしりたんていシリーズ,トロル,0000591,ポプラ社,43109435,おしりたんてい　アニメコミック,,20221013,4684,アニメコミックおしりたんてい,
9784763140210,ぺんたと小春のめんどいまちがいさがし　ＢＩＧ,,1076,16,0061,0001,0015,書籍,児童書,実用百科,実用百科,迷路・パズル,ペンギン飛行機製作所,0007631,サンマーク出版,43368795,ぺんたと小春のめんどいまちがいさがし　ＢＩＧ,,20221110,3548,,
9784791631438,頂上決戦！異種最強生物　オールスター大決戦,,1076,16,0061,0001,0091,書籍,児童書,実用百科,実用百科,その他実用百科,ＣｒｅａｔｕｒｅＳｔｏｒｙ,0007916,西東社,43378398,頂上決戦！異種最強生物　オールスター大決戦,,20221220,2915,,
9784791631926,ミラクルハピネス　誕生日＆うらない大全,,1076,16,0061,0001,0021,書籍,児童書,実用百科,実用百科,心理ゲーム・占い,ルナ・アヴニール,0007916,西東社,43370161,ミラクルハピネス　誕生日＆うらない大全,,20221015,1975,,
9784834086805,どきどきキッチンサーカス,,1076,16,0007,0005,0003,書籍,児童書,絵本,福音館書店,幼児絵本福音館書店,石津ちひろ,0008340,福音館書店,43358279,どきどきキッチンサーカス,幼児絵本シリーズ,20221007,1042,幼児絵本シリーズ,
9784065292495,ウルトラヒーローｖｓ．ウルトラかいじゅう　だいけっとう！　マグネットＢＯＸ,,1076,16,0021,0001,0041,書籍,児童書,キャラクター絵本,キャラクター絵本,ヒーロー,講談社,0000006,講談社,43357379,ウルトラヒーローｖｓ．ウルトラかいじゅう　だいけっとう！　マグネットＢＯＸ,［バラエティ］,20221208,1078,,
9784065299081,ＴＶアニメブルーロッククリアファイルブック,,1076,16,0091,0001,0092,書籍,児童書,グッズ,グッズ,キャラクターグッズ,講談社,0000006,講談社,43379649,ＴＶアニメブルーロッククリアファイルブック,［バラエティ］,20221220,4100,,
9784813780748,総長さま、溺愛中につき。　最強イケメンの溺愛バトルは再加速！？,７,1076,16,0055,0001,0091,書籍,児童書,児童文庫,児童文庫,その他児童文庫,＊あいら＊,0008137,スターツ出版,43205111,総長さま、溺愛中につき。,野いちごジュニア文庫,20221220,9519,,
9784405073623,図解大事典　ドラゴン,,1076,16,0061,0001,0091,書籍,児童書,実用百科,実用百科,その他実用百科,龍・ドラゴン研究チームＴ＆Ｈ,0000405,新星出版社,43370151,図解大事典　ドラゴン,,20221215,1535,,
9784591174975,かいけつゾロリのおやじギャグ＆なぞなぞ大じてん,,1076,16,0041,0005,0011,書籍,児童書,読み物,読み物,かいけつゾロリシリーズ,原ゆたか,0000591,ポプラ社,43372095,かいけつゾロリのおやじギャグ＆なぞなぞ大じてん,,20221107,1194,単行本,
9784046321855,サキヨミ！　恋と決意の文化祭,７,1076,16,0055,0001,0015,書籍,児童書,児童文庫,児童文庫,角川つばさ文庫,七海まち,0000004,ＫＡＤＯＫＡＷＡ,43182126,サキヨミ！,角川つばさ文庫,20221013,3193,,
9784593103621,サンタさんのぼうし　どこいった？,,1076,16,0007,0003,0092,書籍,児童書,絵本,海外絵本,海外絵本,エマニュエル・レ,0000593,ほるぷ出版,43357126,サンタさんのぼうし　どこいった？,海外秀作絵本,20221011,1995,,
9784083217579,海色ダイアリー〜五つ子アイドルと五河の夢〜,,1076,16,0055,0001,0018,書籍,児童書,児童文庫,児童文庫,集英社みらい文庫,みゆ,0000008,集英社,43382708,海色ダイアリー～五つ子アイドルと五河の夢～,集英社みらい文庫,20221216,7164,,
9784265811601,ちびちびうさまる　くまさんといっしょ,,1076,16,0007,0001,0092,書籍,児童書,絵本,国内絵本,国内絵本,ｓａｋｕｍａｒｕ,0000265,岩崎書店,43360127,ちびちびうさまる　くまさんといっしょ,,20221014,1177,,
9784592107170,ノラネコぐんだん大図鑑　１０周年限定特典付き,,1076,16,0007,0001,0201,書籍,児童書,絵本,国内絵本,ノラネコぐんだん,工藤ノリコ,0000592,白泉社,43368273,ノラネコぐんだん大図鑑　１０周年限定特典付き,［バラエティ］,20221118,4152,,
9784591175507,いないいないばあっ！　おうたで　わーい！,,1076,16,0015,0001,0001,書籍,児童書,しかけ絵本,しかけ絵本,音のでる絵本,ｍｉｏ,0000591,ポプラ社,43380291,いないいないばあっ！　おうたで　わーい！,,20221209,3746,単行本,
9784046321879,スイッチ！　大キライなはずなのに！？,１１,1076,16,0055,0001,0015,書籍,児童書,児童文庫,児童文庫,角川つばさ文庫,深海ゆずは,0000004,ＫＡＤＯＫＡＷＡ,42943339,スイッチ！,角川つばさ文庫,20221109,2967,,
9784046321824,星のカービィ　まんぷく、まんまる、グルメフェス！,,1076,16,0055,0001,0015,書籍,児童書,児童文庫,児童文庫,角川つばさ文庫,高瀬美恵,0000004,ＫＡＤＯＫＡＷＡ,43345582,星のカービィ　ディスカバリー,角川つばさ文庫,20221214,17708,,
9784046322067,泣き虫スマッシュ！　がけっぷちのバドミントンペア、はじまる！？,１,1076,16,0055,0001,0015,書籍,児童書,児童文庫,児童文庫,角川つばさ文庫,平河ゆうき,0000004,ＫＡＤＯＫＡＷＡ,43369728,泣き虫スマッシュ！,,20221109,1515,,
9784046322173,ジュニア　空想科学読本,２５,1076,16,0055,0001,0015,書籍,児童書,児童文庫,児童文庫,角川つばさ文庫,柳田理科雄,0000004,ＫＡＤＯＫＡＷＡ,42475688,ジュニア　空想科学読本,角川つばさ文庫,20221214,2835,,
9784074531738,ゆめみる　おひめさま図鑑,,1076,16,0007,0001,0092,書籍,児童書,絵本,国内絵本,国内絵本,たけいみき,0000007,主婦の友社,43380010,ゆめみる　おひめさま図鑑,,20221208,1388,,
9784052056581,ゆるゆる昆虫図鑑,,1076,16,0071,0001,0401,書籍,児童書,学習百科,学習百科,理科　昆虫,さのかける,0000005,学研プラス,43369408,ゆるゆる昆虫図鑑,,20221129,3593,,
9784097252078,かぼちゃスープのおふろ,,1076,16,0007,0001,0092,書籍,児童書,絵本,国内絵本,国内絵本,柴田ケイコ,0000009,小学館,43379656,かぼちゃスープのおふろ,,20221118,1621,,
9784591175026,歴史ゴーストバスターズ　歴女失格！？　お泊まり会で大波乱の夏休み！,４,1076,16,0055,0001,0091,書籍,児童書,児童文庫,児童文庫,その他児童文庫,あさばみゆき,0000591,ポプラ社,43250741,歴史ゴーストバスターズ,ポプラキミノベル　創作,20221013,2394,ポプラキミノベル　創作,
9784052056819,なぜ？がわかる！　にゃんこ大戦争クイズブック　〜科学のぎもん編〜,,1076,16,0061,0001,0011,書籍,児童書,実用百科,実用百科,クイズ・なぞなぞ,ＰＯＮＯＳ,0000005,学研プラス,43375611,なぜ？がわかる！　にゃんこ大戦争クイズブック　～科学のぎもん編～,,20221215,1836,,
9784065293423,ディズニーガールズと　いっしょに　おふろで　あいうえお　アルファベットひょうつき,,1076,16,0091,0001,0004,書籍,児童書,グッズ,グッズ,ウォールチャート,講談社,0000006,講談社,43362345,ディズニーガールズと　いっしょに　おふろで　あいうえお　アルファベットひょうつき,,20221018,1298,,
9784053056191,２０２３年入試用重大ニュース　時事問題に強くなる本　中学・高校入試,,1076,19,0011,0061,0003,書籍,学習参考書,小学学参,中学入試,重大ニュース,Ｇａｋｋｅｎ,0000005,学研プラス,43360369,２０２３年入試用重大ニュース　時事問題に強くなる本　中学・高校入試,,20221013,2594,,
9784057508382,妖怪最強王図鑑フィギュア,,1076,16,0091,0001,0091,書籍,児童書,グッズ,グッズ,その他グッズ,ｍｉｏ,0000005,学研プラス,43369073,妖怪最強王図鑑フィギュア,［バラエティ］　最強王図鑑シリーズ,20221126,13759,最強王図鑑シリーズ,
9784092893078,小学館世界Ｊ文学館,,1076,16,0041,0001,0003,書籍,児童書,読み物,名作読み物,海外の名作読み物,浅田次郎,0000009,小学館,43355658,小学館世界Ｊ文学館,,20221118,1172,,
9784591174814,小説　魔入りました！入間くん　アクドルくろむちゃんとアメリの決断,４,1076,16,0055,0001,0091,書籍,児童書,児童文庫,児童文庫,その他児童文庫,針とら,0000591,ポプラ社,43264725,小説　魔入りました！入間くん,ポプラキミノベル,20221005,3591,ポプラキミノベル　ノベライズ,
9784092172661,図解はじめての絵画,,1076,16,0081,0001,0011,書籍,児童書,図鑑,図鑑,学習図鑑シリーズ,青柳正規,0000009,小学館,43388151,図解はじめての絵画,小学館の図鑑ＮＥＯアート,20230206,6646,,
9784533151545,るるぶマンガとクイズで楽しく学ぶ！日本の歴史人物伝,,1076,16,0071,0005,0091,書籍,児童書,学習百科,学習漫画,その他学習漫画,伊藤賀一,0000533,ＪＴＢ,43370158,るるぶマンガとクイズで楽しく学ぶ！日本の歴史人物伝,,20221115,1349,こども絵本[学習まんが],
9784074521562,きみのこころをつよくする　えほん,,1076,16,0007,0001,0092,書籍,児童書,絵本,国内絵本,国内絵本,足立啓美,0000007,主婦の友社,43360941,きみのこころをつよくする　えほん,,20221004,1376,,
9784065289020,トミカ　タブレットがた　おしゃべりえほん,,1076,16,0021,0001,0012,書籍,児童書,キャラクター絵本,キャラクター絵本,トミカ,講談社,0000006,講談社,43341015,トミカ　タブレットがた　おしゃべりえほん,［バラエティ］,20221212,1541,,
9784046321978,トップ・シークレット　決戦前夜のショータイム！,４,1076,16,0055,0001,0015,書籍,児童書,児童文庫,児童文庫,角川つばさ文庫,あんのまる,0000004,ＫＡＤＯＫＡＷＡ,43284068,トップ・シークレット,角川つばさ文庫,20230112,1601,,
9784046322050,サキヨミ！　トラブルまみれのデート作戦！,８,1076,16,0055,0001,0015,書籍,児童書,児童文庫,児童文庫,角川つばさ文庫,七海まち,0000004,ＫＡＤＯＫＡＷＡ,43387254,サキヨミ！　トラブルまみれのデート作戦！,角川つばさ文庫,20230208,1316,,
9784092314405,華麗なる探偵アリス＆ペンギン　キャッツ・イン・ザ・スカイ,,1076,16,0055,0001,0019,書籍,児童書,児童文庫,児童文庫,小学館ジュニア文庫,南房秀久,0000009,小学館,43381820,華麗なる探偵アリス＆ペンギン　キャッツ・イン・ザ・スカイ,小学館ジュニア文庫,20221125,1185,小学館ジュニア文庫,
9784415331942,音と光のでる絵本　スイッチくるくる,,1076,16,0015,0001,0001,書籍,児童書,しかけ絵本,しかけ絵本,音のでる絵本,かしわらあきお,0000415,成美堂出版,43376866,音と光のでる絵本　スイッチくるくる,［バラエティ］,20221102,4143,,
9784065309926,プリキュアオールスターズ　さがして！プリキュア,,1076,16,0021,0001,0045,書籍,児童書,キャラクター絵本,キャラクター絵本,ヒロイン,東映アニメーション,0000006,講談社,43393230,プリキュアオールスターズ　さがして！プリキュア,,20230208,1464,,
9784569880921,青鬼　調査クラブ　怪物を従えた少女と激突せよ！,７,1076,16,0055,0001,0091,書籍,児童書,児童文庫,児童文庫,その他児童文庫,波摘,0000569,ＰＨＰ研究所,43113004,青鬼　調査クラブ,ＰＨＰジュニアノベル,20230126,1319,PHPジュニアノベル,
9784083217555,天宮家の王子さま　メイドのわたしのバレンタイン計画！,,1076,16,0055,0001,0018,書籍,児童書,児童文庫,児童文庫,集英社みらい文庫,白井ごはん,0000008,集英社,43382706,天宮家の王子さま　メイドのわたしのバレンタイン計画！,集英社みらい文庫,20221216,1937,天宮家の王子さま,
9784479393948,勇者たちの中学受験　わが子が本気になったとき、私の目が覚めたとき,,1076,19,0011,0021,0001,書籍,学習参考書,小学学参,勉強法,勉強法,おおたとしまさ,0000479,大和書房,43378073,勇者たちの中学受験　わが子が本気になったとき、私の目が覚めたとき,,20221112,4672,,
9784083217531,鬼滅の刃　ノベライズ　〜カナヲと無一郎！　命をかけた闘い編〜,,1076,16,0055,0001,0018,書籍,児童書,児童文庫,児童文庫,集英社みらい文庫,吾峠呼世晴,0000008,集英社,43375620,鬼滅の刃　ノベライズ　～カナヲと無一郎！　命をかけた闘い編～,集英社みらい文庫,20221125,7517,鬼滅の刃 ノベライズ,
9784408640617,マンガでよくわかる　ねこねこ日本史＜ジュニア版＞,１１,1076,16,0071,0001,0047,書籍,児童書,学習百科,学習百科,歴史（読みもの）,そにしけんじ,0000408,実業之日本社,42910337,マンガでよくわかる　ねこねこ日本史＜ジュニア版＞,,20221201,1337,,
9784278087093,あかちゃん　あかちゃん,２,1076,16,0011,0002,0001,書籍,児童書,幼児絵本,ファーストブック,ファーストブック,おおのたろう,0000278,大泉書店,43321352,あかちゃん　あかちゃん,,20221130,1034,,
9784083217470,絶対好きにならない同盟　〜歌姫はラブソングが超ニガテ！〜,,1076,16,0055,0001,0018,書籍,児童書,児童文庫,児童文庫,集英社みらい文庫,夜野せせり,0000008,集英社,43366738,絶対好きにならない同盟　～歌姫はラブソングが超ニガテ！～,集英社みらい文庫,20221028,1583,絶対好きにならない同盟,
9784591175118,新装版　どうぶつえあわせ　ぴったりカード,,1076,16,0091,0001,0003,書籍,児童書,グッズ,グッズ,知育カード,わらべきみか,0000591,ポプラ社,43365878,新装版　どうぶつえあわせ　ぴったりカード,,20221005,1146,単行本,
9784591175125,新装版　のりものえあわせ　ぴったりカード,,1076,16,0091,0001,0003,書籍,児童書,グッズ,グッズ,知育カード,わらべきみか,0000591,ポプラ社,43365879,新装版　のりものえあわせ　ぴったりカード,,20221005,1062,単行本,
9784265074877,にじいろフェアリーしずくちゃん　７つのストーンのひみつ,７,1076,16,0041,0005,0005,書籍,児童書,読み物,読み物,低学年読み物,友永コリエ,0000265,岩崎書店,43064309,にじいろフェアリーしずくちゃん,,20221213,2726,しずくちゃん,
9784049145663,星のカービィ　プププヒーロー　プププランド最大の事件！！編,,1076,16,0021,0001,0051,書籍,児童書,キャラクター絵本,キャラクター絵本,その他キャラクター,あおきけい,0000004,ＫＡＤＯＫＡＷＡ,43375601,星のカービィ　プププヒーロー　プププランド最大の事件！！編,,20221214,3415,,
9784522803356,サイレンカー　だいずかん　６５ピース,,1076,16,0091,0001,0013,書籍,児童書,グッズ,グッズ,ジグソーパズル,松島浩一郎,0000522,永岡書店,43365873,サイレンカー　だいずかん　６５ピース,頭のいい子を育むジグソー知育パズル,20221011,1267,頭のいい子を育む　ジグソー知育パズル,
9784083217562,おチビがうちにやってきた！　動物園で事件！あらたな能力児、あらわる！？,,1076,16,0055,0001,0018,書籍,児童書,児童文庫,児童文庫,集英社みらい文庫,柴野理奈子,0000008,集英社,43382707,おチビがうちにやってきた！　動物園で事件！あらたな能力児、あらわる！？,集英社みらい文庫,20221216,2036,,
9784065301821,氷の上のプリンセス　シニア編,３,1076,16,0055,0001,0011,書籍,児童書,児童文庫,児童文庫,青い鳥文庫,風野潮,0000006,講談社,43308401,氷の上のプリンセス　シニア編,講談社青い鳥文庫,20221214,1209,,
9784083217524,生き残りゲーム　ラストサバイバル　かせぐが勝ちの学園生活！　サバイバルポイント,,1076,16,0055,0001,0018,書籍,児童書,児童文庫,児童文庫,集英社みらい文庫,大久保開,0000008,集英社,43375619,生き残りゲーム　ラストサバイバル　かせぐが勝ちの学園生活！　サバイバルポイント,集英社みらい文庫,20221125,1434,ラストサバイバルシリーズ,
9784813780670,放課後★七不思議！　イケメンたちが優結を救う！？涙と笑顔のハッピーエンド,,1076,16,0055,0001,0091,書籍,児童書,児童文庫,児童文庫,その他児童文庫,永良サチ,0008137,スターツ出版,43365496,放課後★七不思議！　イケメンたちが優結を救う！？涙と笑顔のハッピーエンド,野いちごジュニア文庫,20221020,1215,,
9784041129081,パンどろぼうほかほかギフトボックス絵本３冊＋メッセージカード（全３冊セット）,,1076,16,0007,0001,0097,書籍,児童書,絵本,国内絵本,３才〜国内絵本,柴田ケイコ,0000004,ＫＡＤＯＫＡＷＡ,43368305,パンどろぼうほかほかギフトボックス絵本３冊＋メッセージカード（全３冊セット）,,20221109,2829,,
9784083217517,霧島くんは普通じゃない　〜ヴァンパイア三兄弟と同居！？　ドキドキの新学期〜,,1076,16,0055,0001,0018,書籍,児童書,児童文庫,児童文庫,集英社みらい文庫,麻井深雪,0000008,集英社,43375618,霧島くんは普通じゃない　～ヴァンパイア三兄弟と同居！？　ドキドキの新学期～,集英社みらい文庫,20221125,9859,霧島くんは普通じゃない,
9784813780717,となりの一条三兄弟！,３,1076,16,0055,0001,0091,書籍,児童書,児童文庫,児童文庫,その他児童文庫,永良サチ,0008137,スターツ出版,43313007,となりの一条三兄弟！,野いちごジュニア文庫,20221118,1282,,
9784052056239,ひみつの魔女フレンズ　まいごの子犬と魔法のリング,５,1076,16,0041,0005,0021,書籍,児童書,読み物,読み物,高学年読み物,宮下恵茉,0000005,学研プラス,43230639,ひみつの魔女フレンズ,,20221201,1437,ひみつの魔女フレンズ,
9784487815340,小学生のうちに覚えておくといいことカルタ,,1076,16,0091,0001,0005,書籍,児童書,グッズ,グッズ,かるた,東京書籍出版事業部,0000487,東京書籍,43375231,小学生のうちに覚えておくといいことカルタ,［バラエティ］,20221208,1075,,
9784046061270,じんせいさいしょの,,1076,16,0011,0002,0001,書籍,児童書,幼児絵本,ファーストブック,ファーストブック,おおのたろう,0000004,ＫＡＤＯＫＡＷＡ,43384710,じんせいさいしょの,,20230126,1109,,
9784083217661,戦国姫　徳川家康と愛しき姫君たち　江姫、東福門院和子ほか,,1076,16,0055,0001,0018,書籍,児童書,児童文庫,児童文庫,集英社みらい文庫,藤咲あゆな,0000008,集英社,43386789,戦国姫　徳川家康と愛しき姫君たち　江姫、東福門院和子ほか,集英社みらい文庫,20230127,1132,戦国姫,
9784083217500,二条くんはわたしの執事　ダンスパーティーで運命の告白！？,,1076,16,0055,0001,0018,書籍,児童書,児童文庫,児童文庫,集英社みらい文庫,小桜すず,0000008,集英社,43375617,二条くんはわたしの執事　ダンスパーティーで運命の告白！？,集英社みらい文庫,20221125,1085,二条くんはわたしの執事,
9784299033833,まいぜんシスターズのまちがいさがしＢＯＯＫ,,1076,16,0007,0004,0001,書籍,児童書,絵本,さがしもの絵本,さがしもの絵本,まいぜんシスターズ,0000299,宝島社,43373394,まいぜんシスターズのまちがいさがしＢＯＯＫ,,20221025,8641,,
9784299035875,桃太郎電鉄でわかる歴史の英雄大図鑑,,1076,16,0071,0001,0047,書籍,児童書,学習百科,学習百科,歴史（読みもの）,村瀬哲史,0000299,宝島社,43377522,桃太郎電鉄でわかる歴史の英雄大図鑑,,20221118,1124,,
9784522803363,あつまれ！　きょうりゅう　３５ピース,,1076,16,0091,0001,0013,書籍,児童書,グッズ,グッズ,ジグソーパズル,加藤愛一,0000522,永岡書店,43365874,あつまれ！　きょうりゅう　３５ピース,頭のいい子を育むジグソー知育パズル,20221011,1013,頭のいい子を育む　ジグソー知育パズル,
9784083217593,戦国姫　徳川家康と運命の姫君たち　於大の方、瀬名姫ほか,,1076,16,0055,0001,0018,書籍,児童書,児童文庫,児童文庫,集英社みらい文庫,藤咲あゆな,0000008,集英社,43382710,戦国姫　徳川家康と運命の姫君たち　於大の方、瀬名姫ほか,集英社みらい文庫,20221216,1921,戦国姫,
9784774738604,とびだす！かわいい！どうぶつピアノ,,1076,16,0015,0001,0001,書籍,児童書,しかけ絵本,しかけ絵本,音のでる絵本,ｍｉｏ,0007747,コスミック出版,43383715,とびだす！かわいい！どうぶつピアノ,［バラエティ］,20221216,1256,,
9784065296851,小説　ブルーロック,１,1076,16,0055,0001,0091,書籍,児童書,児童文庫,児童文庫,その他児童文庫,吉岡みつる,0000006,講談社,43367241,小説　ブルーロック,講談社ＫＫ文庫,20221117,1828,,
9784865492859,おせちのみんなあつまって！,,1076,16,0011,0003,0005,書籍,児童書,幼児絵本,知育絵本,たべもの絵本,真珠まりこ,0086549,ひさかたチャイルド,43367256,おせちのみんなあつまって！,,20221114,1838,,
9784265820658,ほねほねザウルス　パーフェクト図鑑,,1076,16,0041,0005,0013,書籍,児童書,読み物,読み物,ほねほねザウルスシリーズ,カバヤ食品,0000265,岩崎書店,43370950,ほねほねザウルス　パーフェクト図鑑,,20221117,2312,ほねほねザウルス,
9784083217678,逃走中　オリジナルストーリー　暗闇からハンター！？　夜の遊園地で恐怖に立ちむかえ！,,1076,16,0055,0001,0018,書籍,児童書,児童文庫,児童文庫,集英社みらい文庫,逃走中,0000008,集英社,43386790,逃走中　オリジナルストーリー　暗闇からハンター！？　夜の遊園地で恐怖に立ちむかえ！,集英社みらい文庫,20230127,3416,逃走中 オリジナルストーリー,
